"id";"nome_completo";"nome_citacoes";"nome_orgao";"updated_at"
5322033719702372;Joenvilly Cardinele Rego Oliveira;OLIVEIRA, J. C. R.;Hospital Universitário da Universidade Federal do Maranhão;2021-02-09 12:30:28
140662162550129;Denilson Amorim Vieira;"VIEIRA, D. A.;VIEIRA, DENILSON AMORIM;VIEIRA, DENILSON A.";Laboratório de Pesquisa e Pós-Graduação;2021-02-09 10:50:57
8393048274534190;Maria Clara Rodrigues Lima Medeiros;MEDEIROS, M. C. R. L.;Secretaria Municipal de Saúde de Bacabal;2019-03-11 01:15:31
6347825817988231;Ivan Abreu Figueiredo;"FIGUEIREDO, Ivan Abreu;FIGUEIREDO, IVAN ABREU";Associação de Ensino;2021-02-09 12:12:38
3210861149625068;Keiko Aramaki Abreu Calado;CALADO, K. A. A.;"";2019-03-11 00:49:39
3185186330839488;Mayara Damiane Gomes Soares;SOARES, M. D. G.;"";2019-12-16 00:07:48
7602714735898573;Débora Rodrigues Stefanello;"STEFANELLO, D. R.;DEBORA R. S";Centro Tecnológico;2019-12-15 21:21:49
3478049785850569;Maria Aparecida Alves de Oliveira Serra;"OLIVEIRA, M. A. A.;DE OLIVEIRA, MARIA APARECIDA ALVES;ALVES DE OLIVEIRA SERRA, MARIA APARECIDA;Serra, Maria Aparecida Alves de Oliveira;OLIVEIRA SERRA, M.A.A;OLIVEIRA SERRA, M.A.A.;SERRA, M.A.A.O.;Serra, M.A.A.O.;SERRA MAAO;OLIVEIRA SERRA, MARIA APARECIDA ALVES DE;A.O. SERRA, MARIA APARECIDA;SERRA, MARIA APARECIDA A. O.;DE OLIVEIRA SERRA, MARIA APARECIDA ALVES";Centro de Ciências Sociais, Saúde e Tecnologia;2021-02-09 13:45:55
2710104222777017;Adriana Oliveira Dias de Sousa Morais;MORAIS, A. O. D. S.;Faculdade Santa Terezinha- CEST;2019-05-03 17:16:44
1779899066481904;Silvania dos Santos Rabelo;RABELO, S. S.;"";2021-02-09 15:37:04
3714346932912859;Diogo Henrique Moraes;MORAES, D. H.;"";
6162113647472848;Denilson da Silva Bezerra;"BEZERRA, Denilson da Silva;BEZERRA, DENILSON DA SILVA;BEZERRA, DENILSON SILVA;DA SILVA BEZERRA, DENILSON";Departamento de Oceanografia e Limnologia (DEOLI);2021-02-09 10:51:00
2544079224940037;Rachid Santos Maluf;MALUF, R. S.;"";2019-12-16 00:34:31
3333890502662570;Ricardo Vinhaes Maluf Cavalcante;"CAVALCANTE, R. V. M.;Cavalcante, Ricardo Vinhaes Maluf";"";2021-02-09 15:06:07
773418608689579;Denilson Moreira Santos;"SANTOS, D. M.;SANTOS, DENILSON MOREIRA;SANTOS, DENILSON SANTOS;SANTOS, DENILSON MOREIRA DOS;SANTOS, DENILSON";Centro Tecnológico;2021-02-09 10:51:10
2286922497410969;Leonardo Rogério da Silva Rodrigues;RODRIGUES, L. R. S.;"";2021-02-09 13:08:27
1314140676603710;Rafael Bezerra Gaspar;GASPAR, Rafael Bezerra;"";2019-05-03 20:02:39
4205661964954269;Luciana Railza Cunha Alves;ALVES, L. R. C.;"";2018-05-01 13:03:48
1768904624817843;Paolla Tiemy de Freitas Tsuru;TSURU, P. T. F.;Hospital Universitário da Universidade Federal do Maranhão;2018-05-01 13:40:30
7968235987222372;Edson Diniz Ferreira Filho;FERREIRA FILHO, Edson Diniz;Centro Tecnológico;
8260619467701113;Yara Maria Cavalcante de Portela;PORTELA, Y. M. C.;Centro de Ciências Humanas, Naturais, Saúde e Tecnologia (CCHNST) -Pinheiro;2021-02-09 16:11:56
4997164715902020;Arleane Debora dos Santos Gonçalves;"GONÇALVES, A. D. S.;GONÇALVES, Arleane";"";
2154839067839032;Sílvia Cristina Duailibe Costa;COSTA, S. C. D.;Centro de Estudos Básicos;2021-02-09 15:37:49
3563939748645929;Manoel Renato Muniz Farias;FARIAS, M. R. M.;IFMA;2020-08-10 17:23:07
9007740626105654;Denise Bessa Léda;"LÉDA, D. B.;LEDA, DENISE BESSA;Léda, D.B.;Léda, D. B.";Centro de Estudos Básicos;2021-02-09 10:51:22
1811137664490146;Wanderson Martins Licar da Silva;SILVA, W. M. L.;"";2021-02-09 16:07:20
7591210570620690;Ethelanny Pantaleão Leite;LEITE, E. P.;"";2017-11-06 17:11:45
3257249664727428;Alan Kardec Reis Paciencia;PACIENCIA, A. K. R.;"";2021-02-09 09:15:42
2127898251932900;Wanessa Cristina Filgueiras Fonsêca;FONSÊCA, W. C. F.;"";2019-12-16 01:34:23
4332509767255929;Arissane de Sousa Falcão;FALCÃO, A. S.;"";2019-12-15 20:48:50
588907119958839;Kilza Fernanda Moreira de Viveiros;"VIVEIROS, K. F. M.;VIVEIROS, KILZA FERNANDA MOREIRA;VIVEIROS, KILZA FERNANDA MOREIRA DE";Centro de Ciências Sociais;2021-02-09 13:01:23
1050807927658848;Euclides Barbosa Moreira Neto;MOREIRA NETO, Euclides;Centro de Ciências Sociais;2021-02-09 11:21:04
3415005063379291;Gisele Pereira Sousa;SOUSA, G. P.;"";2021-02-09 11:53:27
9533355528920092;Dario Itapary Nicolau;NICOLAU, D. I.;"";2021-02-09 10:46:39
1713600548135321;Denise Cristina Ayres Gomes;"GOMES, D. C. A.;AYRES GOMES, DENISE CRISTINA;GOMES DCA;GOMES, Denise Cristina Ayres";Centro de Ciências Sociais, Saúde e Tecnologia - CCSST;2021-02-09 10:51:40
7648833773471684;Erik Costa Macedo;MACEDO, E. C.;"";2018-05-01 12:09:38
5024549753418991;Erica Vanessa Ramos Costa;COSTA, E. V. R.;Associação de Ensino;2018-11-16 11:32:35
863719644762472;Vera Lúcia Bezerra Santos;"SANTOS, V. L. B.;SANTOS, Vera L.B.";Centro de Ciências Sociais Aplicadas;2019-05-03 20:34:50
9801170852261516;Felipe Peixoto Poulis;F. P. Poulis;Centro Tecnológico;2021-02-09 11:25:15
771206221113487;Nathálie Ferreira Santos;SANTOS, N. F.;"";
670520594680554;Gislane Pinho de Oliveira;OLIVEIRA, G. P.;Campus Balsas;2021-02-09 11:54:01
586821085096772;Felipe Sávio Cardoso Teles Monteiro;MONTEIRO, F. S. C. T;"";2021-02-09 11:25:33
384462318699779;Mateus Soares da Silva;"SILVA, M. S.;SILVA, MATEUS S.;SILVA, MATEUS SOARES;DA SILVA, MATEUS S.;SILVA, MATEUS";"";2021-02-09 14:15:49
6896240856348029;José Ribamar Wanderley de Souza Junior;SOUZA JÚNIOR, J. R. W.;"";2021-02-09 12:50:52
8554441432063089;Fausto Ricardo Silva Sousa;SOUSA, F. R. S.;"";2019-02-07 17:13:24
7346399893912346;Denise Fernandes Coutinho;"COUTINHO-MORAES, D. F.;COUTINHO, D.F.;MORAES, D.F.C.;MORAIS, D. F. C.;COUTINHO-MORAES, Denise Fernandes;MORAES-COUTINHO, Denise Fernandes;MORAIS D.C.F.;MORAES, D. F. C.;MORAES, DENISE F. C.;MORAES, DENISE FERNANDES COUTINHO;COUTINHO-MORAES, DENISE F.;COUTINHO MORAES, Denise;COUTINHO, DENISE FERNANDES;COUTINHO, DENISE;Denise F. Coutinho;COUTINHO, DENISE F.;Fernandes Coutinho, Denise";Centro de Ciências da Saúde;2021-02-09 10:51:50
3296141274841497;Flávia Carvalho de Oliveira Paixão;PAIXÃO, F. C. O.;Campus do Bacanga - Prédio de Odontologia;2019-02-17 23:59:03
6679540741076897;Flaviana Oliveira de Carvalho;"OLIVEIRA, F. S.;OLIVEIRA-DE-CARVALHO, F.";"";
2263261015778150;Maria de Fátima Ribeiro Franco Lauande;"LAUANDE, M. F. R. F.;Lauande, M. F. R. F.";Centro de Ciências Sociais;2019-03-11 01:16:58
7611180871627212;Denivaldo Cicero Pavão Lopes;"LOPES, Denivaldo;Lopes, Denivaldo;Denivaldo Lopes;LOPES, DENIVALDO CICERO PAVÃO";Centro Tecnológico;2021-02-09 10:52:59
3752326786439481;Ana Margarida Melo Nunes;"NUNES, Ana Margarida Melo;Nunes, Ana Margarida Melo;NUNES, ANA MARGARIDA;NUNES, ANA MARGARIDA M.";"";2021-02-09 09:36:59
6875640365351829;Jonnas Franco Ferreira;FERREIRA, J. F.;"";
664097887481680;Bárbara Cristina Silva Pereira;PEREIRA, B. C. S.;"";2021-02-09 10:10:40
9638557109648768;Beatriz Cândida Silva Santana;SANTANA, B. C. S.;"";2021-02-09 10:10:49
5006367826417856;Yan Levy Lima Nunes;NUNES, Y. L. L.;"";2021-02-09 16:11:55
8377153616698941;Francisca Agda Alexandre de Araujo;ARAUJO, F.A.A;"";2018-05-01 12:17:40
7600882185941353;Deysianne Costa das Chagas;"CHAGAS, Deysianne Costa das;CHAGAS, DEYSIANNE COSTA DAS;CHAGAS, DEYSIANNE;COSTA DAS CHAGAS, DEYSIANNE";Centro de Ciências da Saúde;2021-02-09 10:53:17
2090528002478933;Diego Paes de Andrade Peña;"PEÑA, D. P. A.;PAES DE ANDRADE PEÑA, DIEGO";"";2021-02-09 10:54:32
426866557350159;Geilson Mendes dos Reis;REIS, G. M.;"";2020-08-10 16:16:50
3403632815672871;Graciomar Conceição Costa;"COSTA, G.C.;COSTA, GRACIOMAR C;COSTA, GRACIOMAR CONCEIÇÃO;GRACIOMAR, C. COSTA";"";2021-02-09 11:56:25
9231276587450618;Geovani Pantoja Parente;PARENTE, G. P.;"";2019-05-03 18:29:55
9880942516283090;Greiciane Pinto Lima;LIMA, G. P.;"";2021-02-09 11:57:10
6186532880175192;Letícia Conceição Martins Cardoso;CARDOSO, L. C. M.;Centro de Ciências Sociais;2021-02-09 13:09:25
9583716656133986;Íthalo da Silva Castro;"CASTRO, Í. S;CASTRO, I. S.;CASTRO, ITHALO DA SILVA";"";2018-01-16 16:17:00
3614800716230146;Thiago Jansen Nunes;NUNES, T. J.;Centro de Ciências da Saúde;2019-03-11 02:18:15
2977313003340231;Silvia Helena Cavalcante de Sousa;"SOUSA, S. H. C.;DE SOUSA, SILVIA H.C.;GODOY, SILVIA HELENA CAVALCANTE DE SOUZA;SOUZA,SILVIA HELENA CAVALCANTE DE;DE SOUZA, SILVIA HELENA CAVALCANTE;DE SOUZA, SÍLVIA HELENA CAVALCANTE;Sousa,SHC";Hospital Universitário da Universidade Federal do Maranhão;2021-02-09 15:37:58
8913618527861120;Maria Inês Gomes de Oliveira;"OLIVEIRA, M. I. G.;Maria Inês Gomes de Oliveira;Maria Inês Oliveira;Oliveira,M I G;OLIVEIRA, M I G;OLIVEIRA, MARIA INÊS GOMES DE";UNIDADE PRESIDENTE DUTRA;2019-05-03 19:37:45
7633585207951429;Anamaria Sousa Silva;SILVA, Anamaria Sousa;Tribunal de Justiça do Estado do Maranhão;2021-02-09 09:37:16
3208933962036057;Ana Paula Gameiro Cappelli;"CAPPELLI, Ana Paula Gameiro;CAPPELLI, A;Cappelli, A.P.;CAPPELLI, APG;CAPPELLI;Cappelli, Ana P.;CAPPELLI, ANA P. G.;CAPPELLI, ANA PAULA;CAPPELLI, AP;CAPPELLI, ANA PAULA G.";Centro de Ciências da Saúde;2021-02-09 09:37:34
4881887727070708;Marcelo Ferreira Pinho;PINHO, M. F.;"";2021-02-09 13:36:04
3445508548478348;Patrícia Costa Ataide;ATAIDE, P. C.;"";2021-02-09 14:37:54
1172018188120055;Patrícia Pinheiro Menegon;"MENEGON, Patrícia P.;MENEGON, PATRÍCIA PINHEIRO";"";2021-02-09 14:39:56
6661978635061819;Gracy Chrisley Alencar Carvalho;"CARVALHO, G.C.A;CARVALHO, GRACY CHRISLEY ALENCAR";"";
1467367851182520;Herberth Vera Cruz Furtado Marques;MARQUES, H. V. C. F.;Centro Tecnológico;2018-05-01 12:29:54
5924290036915867;Leudo Campos Silva;"Leudo Campos;L Campos";"";2021-02-09 13:10:29
9015682722006338;Lia Silva Fonteles Serra;"FONTELES, L. S.;SERRA, LIA S. F.;FONTELES-SERRA. Lia S.";"";2021-02-09 13:10:54
3267683322470733;Ricieri Carlini Zorzal;"ZORZAL, R. C.;ZORZAL, RICIERI CARLINI";Centro de Ciências Humanas;2021-02-09 15:07:02
1023636526511478;Gustavo Pereira Calado;"CALADO, G. P.;CALADO, GUSTAVO P.";"";2018-11-16 11:49:24
153120425512429;Amanda de Sousa Rego;REGO, A. S.;"";2019-05-03 17:24:34
43907928918552;Ingrid de Campos Albuquerque;"ALBUQUERQUE, I. C.;ALBUQUERQUE, INGRID DE CAMPOS;DE CAMPOS ALBUQUERQUE, INGRID";"";2018-05-01 12:32:36
5296507060268086;Bruna de Melo Silva;SILVA, B. M.;"";2021-02-09 10:13:12
9218534468134422;Bruno Salatiel da Silva Rodrigues;RODRIGUES, B. S. S.;"";2021-02-09 10:14:54
6433225775903899;Mayara Pinheiro Fortes;FORTES, M. P.;"";2021-02-09 14:17:19
4264232042521210;Jaciara Sá Santana;SANTANA, J. S.;Unidades Suplementares;2021-02-09 12:15:12
4831631346909667;Jacira do Nascimento Serra;"SERRA, J. N.;SERRA, JACIRA DO NASCIMENTO";Centro de Ciências da Saúde;2021-02-09 12:15:21
8017235221084348;Maria Lucia Guterres Costa;COSTA, M. L. G.;Centro de Ciências da Saúde;2021-02-09 14:00:58
2011486771825354;Marcelo Pereira da Silva;"SILVA, Marcelo da.;SILVA, MARCELO DA;SILVA, Marcelo Pereira da;PEREIRA DA SILVA, MARCELO;Silva, Marcelo Pereira da.";Centro de Ciências Sociais;2019-12-15 23:37:31
9798709426741139;Alexandre Magno de Sousa Nunes;NUNES, A. M. S.;"";2019-12-15 20:19:51
5918120268518866;Dimas dos Reis Ribeiro;RIBEIRO, Dimas dos Reis.;Campus Pinheiro;2021-02-09 10:55:00
8603879841510002;Hellen Jose Daiane Alves Reis;"REIS, H. J. D. A.;ALVES REIS, HELLEN JOSÉ DAIANE";"";2020-05-18 19:44:50
2013273011748287;Vanessa Moreira da Silva Soeiro;"SILVA, V. M.;SOEIRO, V. M. S.;SOEIRO, Vanessa Moreira da Silva";"";2020-08-10 18:53:32
4766638818947766;Mayara Soares Cunha Carvalho;"CUNHA, M. S.;CUNHA, MAYARA SOARES";"";2021-02-09 14:17:20
6275535687919566;Ruan Didier Bruzaca Almeida Vilela;"BRUZACA, R. D.;BRUZACA, RUAN DIDIER;VILELA, RUAN DIDIER BRUZACA ALMEIDA";"";2021-02-09 15:23:11
2209488788655873;Vanessa Samer Siqueira Silva;SILVA, V. S. S.;"";2019-12-16 01:26:48
4391602626527793;Janaína Bezerra da Silva;SILVA, J. B.;Unidade Básica de Saúde da Família V;2018-05-01 12:36:39
1762004877075277;Gilda Vasconcellos de Andrade;"ANDRADE, G. V.;Andrade, G. V.;Andrade, Gilda V.;Andrade, G.V.;ANDRADE, GV;VASCONCELLOS, GILDA;ANDRADE, GILDA;ANDRADE, GILDA VASCONCELLOS DE";Centro de Ciências da Saúde;2019-03-11 00:11:40
3410008290553309;Méllany Pinheiro Cacau;CACAU, M. P.;"";2021-02-09 14:18:53
1432752484802169;Diogo de Almeida Viana dos Santos;"SANTOS, D. A. V.;Diogo Santos;Santos, Diogo";Centro de Ciências Sociais;2021-02-09 10:55:22
5522084970543943;Dirce do Socorro Ribeiro Alves;ALVES, D. S. R.;"";2021-02-09 10:55:44
5125904184711352;Jaldyr de Jesus Gomes Varela Júnior;"VARELA JÚNIOR, J. J. G.;VARELA JR, J. J. G.;JÚNIOR, JALDYR DE JESUS GOMES VARELA;VARELA JUNIOR, JALDYR;VARELA JÚNIOR, JALDYR;VARELA JÚNIOR, JALDYR DE JESUS GOMES;VARELA JR, JALDYR J. G.;Varela, Jaldyr J G;VARELA, JALDYR DE JESUS GOMES;VARELA, JALDYR J.G.;DE JESUS GOMES VARELA, JALDYR;VARELA JÚNIOR, J. DE J. G.;Varela, JDG;Varela, J.J.G.;DE JESUS GOMES, JALDYR;Varela Júnior, Jaldyr de J G;Varela Júnior, J. De J. G.";Centro Tecnológico;2021-02-09 12:16:20
1500058780905291;Maria Francisca Pereira de Araújo;ARAÚJO, M. F. P.;Hospital Universitário da Universidade Federal do Maranhão;2021-02-09 13:58:55
3692142787417773;Meryl Marylyne Renee Thiel;THIEL, M. M. R.;"";2021-02-09 14:18:57
8401133595281804;João Pedro de Santiago Neto;SANTIAGO NETO, J. P.;Campus São Bernardo;2018-11-16 12:05:03
4594333793387846;Edimo Jose Vaz;VAZ, E. J.;"";2018-05-01 12:01:00
2017159366640765;José Antonio Figueiredo de Almeida Silva;SILVA, J. A. F. A.;"";2019-12-15 22:49:59
5524248121872582;José de Ribamar Castro;CASTRO, J. R.;Centro de Ciências Humanas;
9995384077852468;Rebecca Haje Cintra;CINTRA, R. H.;Faculdade de medicina;2020-05-18 22:15:30
1559787269758740;James Magno Araújo Farias;FARIAS, James Magno Araújo;"";2021-02-09 12:16:40
1977393469384270;Ana Carolina Sá Mendonça;"MENDONÇA, A. C. S.;MENDONÇA, ANA CAROLINA SÁ";"";2019-03-10 23:10:19
1348752746909805;José de Ribamar Oliveira Filho;OLIVEIRA FILHO, J. R.;Instituto de Química de São Carlos;2021-02-09 12:39:58
1661138370842189;Dirlene Santos Barros;"BARROS, Dirlene Santos;Barros, Dirlene Santos";"";2021-02-09 10:55:45
4549361804364050;James Maxwell Fernandes Araujo;ARAUJO, James Maxwell Fernandes;Centro de Ciências Sociais;2021-02-09 12:16:44
1081853078657445;José Américo da Costa Barroqueiro;BARROQUEIRO, J. A. C.;Centro de Ciências da Saúde;2021-02-09 12:37:13
482934681955093;Rebeca Costa Castelo Branco;"BRANCO, R. C. C.;Rebeca Costa Castelo Branco;BRANCO, R.C.C;BRANCO, REBECA COSTA CASTELO";"";2021-02-09 15:00:44
1963334333188201;Rosane de Sousa Miranda;"MIRANDA, R. S.;Miranda, Rosane de Sousa";Departamento de Psicologia;2021-02-09 15:17:49
708860193607869;José Dino Costa Cavalcante;"CAVALCANTE, Dino;CAVALCANTE, José Dino Costa";Departamento de Letras;2021-02-09 12:40:29
4105291419210575;Aline Sharlon Maciel Batista Ramos;"RAMOS, A. S. M. B.;RAMOS, ALINE SHARLON MACIEL BATISTA;SHARLON, A.";Hospital Universitário Unidade Presidente Dutra;2021-02-09 09:25:49
948648102309204;Julio Pereira Filho;PEREIRA FILHO, Julio;null;2021-02-09 12:55:32
4144184099145840;Michelli Erica Souza Ferreira;"FERREIRA, M. E. S.;Michelli E. S. Ferreira;Ferreira, Michelli;FERREIRA, MICHELLI ERICA SOUZA;SOUZA FERREIRA, MICHELLI ERICA;FERREIRA, MICHELLE E. S.";Centro de Ciências da Saúde;2021-02-09 14:20:04
3509136620945906;Fábio Costa de Almeida;ALMEIDA, F. C.;"";2020-05-18 19:14:37
4756471460378471;Ricardo Tadeu Villa;"VILLA, R. T.;VILLA, RICARDOTADEU;VILLA, RICARDO TADEU;Villa, RT;VILLA, RT";"";2021-02-09 15:05:57
3893869787290157;Jocelina Correia Monteiro;MONTEIRO, J. C.;SECRETARIA DE EDUCAÇÃO DO MUNICIPIO;2020-12-02 19:21:12
7631224537067487;Djayna Serra Nunes;NUNES, D. S.;"";2021-02-09 10:56:11
3111839164281798;Domingos Eduardo da Silva;SILVA, D. E.;PROMOTORIA DE JUSTIÇA DE IMPERATRIZ;2021-02-09 10:56:23
1115832947713877;Karuane Saturnino da Silva Araújo;"DA SILVA, K. S.;SILVA, K. S.;ARAÚJO, K. S. S.;ARAÚJO, KARUANE SATURNINO DA SILVA";"";
9477436813440091;Lana Kaíne Leal;LEAL, L. K.;"";2018-11-16 12:21:00
9339578170693084;Dulcinéia de Fátima Ferreira;"PEREIRA, D. F. F.;FERREIRA, D. F.;FERREIRA, DULCINÉIA DE FÁTIMA;FERREIRA, Dulcineia de Fátima Dulce;FERREIRA, DULCINÉIA DE FÁTIMA DULCE";UFSCar - Campus Sorcaba;2021-02-09 10:57:17
2913100595645002;Vaneça Santos Leal Figuerêdo;FIGUERÊDO, V. S. L.;"";2021-02-09 15:57:52
7101089012231364;Lanylldo Araujo dos Santos;SANTOS, L. A.;"";2018-05-01 12:56:11
1543620047259611;Lauber Jose dos Santos Almeida Junior;"Almeida Jr L.J.S.;Santos Almeida L.J.J.;ALMEIDA JR, Lauber Jose dos Santosh;ALMEIDA JR, LAUBER J DOS SANTOSH;Almeida Júnior, LJS;Almeida Junior, LJS;ALMEIDA J?NIOR, Lauber Jose dos Santos;ALMEIDA JÚNIOR, LAUBER JOSE DOS SANTOS";"";
520606565545605;Maria Aparecida de Almeida Araujo;De Almeida Araujo, Maria Aparecida;"";2019-12-15 23:46:28
4012072821338641;Tatiana Menezes Pereira;PEREIRA, T. M.;"";2019-12-16 01:18:11
8705589070925511;Anderson Alles de Jesus;"Alles. A. J.;Jesus A. A.;JESUS, ANDERSON A.;DE JESUS, ANDERSON A;DE JESUS, ANDERSON ALLES;JESUS, A. A.;JESUS, ANDERSON ALLES DE";Instituto de Tecnologia e Pesquisa-ITP;2021-02-09 09:38:38
7750797168022704;Renato Cadore;CADORE, R.;"";2019-05-03 20:07:41
9835751526946877;Larissa Gomes Lacerda;LACERDA, L. G.;"";2018-11-16 12:21:05
8204433275669502;Maria Aparecida de Sá Carvalho de Almada;ALMADA, M. A. S. C.;"";2020-12-02 20:46:53
3072180692534743;Bárbara Larissa Santana Coelho de Oliveira;OLIVEIRA, B. L. S. C.;"";2019-12-15 20:53:28
1260796485994558;Anderson Augusto Soares da Penha;PENHA, A. A. S.;"";2021-02-09 09:38:41
8366575648240693;Protasio Cézar dos Santos;"SANTOS, P. C.;SANTOS, PROTÁSIO CÉZAR DOS;DOS SANTOS, PROTÁSIO CÉZAR";Centro de Ciências Sociais;2021-02-09 14:50:01
6025290771227053;Luana Karonine Cordeiro Castro;CASTRO, L. K. C.;INSTITUTO FLORENCE DE ENSINO SUPERIOR;2020-08-10 17:12:44
402694569025426;Telma Melo da Silva;SILVA, Telma Melo da;IESMA;
2039402780404775;Jamille Fontes Leite;LEITE, J. F.;"";2021-02-09 12:17:04
5222617403246611;Jamesson Ferreira Leite Junior;LEITE JUNIOR, J. F.;Superintendência de Atenção Básica;2020-08-10 16:36:09
6876885944020553;Ricardo Alves de Araújo;"ARAÚJO, R. A.;Ricardo, A.A.;Ricardo Alves de Araújo;Araújo, R.A.;ARAÚJO, Ricardo Alves de;RICARDO, ALVES DE ARA UACUTE JO;ARAÚJO, RICARDO S.;RICARDO ALVES DE ARAÚJO;ARAÚJO, RICARDO ALVES;RICARDO, A.A.;RICARDO A. ARAÚJO;RICARDO A. DE ARAÚJO";Centro de Ciencias Agrarias e Ambientais (CCAA);2019-05-03 20:07:57
598135606543184;Rachel Jorge Dino Cossetti Leal;"COSSETTI, R. J. D.;COSSETTI, RACHEL JORGE D;COSSETTI, RACHEL JORGE DINO;COSSETTI, RACHEL J.D.;COSSETTI, RACHEL;COSSETTI LEAL, RACHEL J D;COSSETTI LEAL, RACHEL D;LEAL, RACHEL D C;DINO COSSETTI, RACHEL JORGE";"";2018-11-16 13:03:52
6909178887358362;Edianne dos Santos Nobre;"NOBRE, Edianne S.;NOBRE, Dia.";Faculdade de Formação;2021-02-09 10:58:51
8756863086330441;Janaína Oliveira Bentivi Pulcherio;"BENTIVI, J. O.;PULCHERIO, J.O.B.;PULCHERIO, JANAÍNA;PULCHERIO, JANAINA OLIVEIRA BENTIVI;PULCHERIO, JANAÍNA OLIVEIRA BENTIVI;BENTIVI, JANAINA OLIVEIRA";"";2020-08-10 16:36:48
4712988099945463;Benedita dos Santos Azevedo;AZEVEDO, B. S.;"";2019-12-15 20:53:45
7973587990819882;Janaina Monteles Aguiar;AGUIAR, J. M.;"";2021-02-09 12:17:52
6827120466182476;Jose Mairton Barros da Silva;SILVA, J. M. B.;Centro Tecnológico;2021-02-09 12:47:25
9764048059533180;Márcio Feres Leite;LEITE, M. F.;"";2021-02-09 13:40:41
3414653659935454;Paulo César Aguiar Martins Vidigal;VIDIGAL, Paulo César Aguiar Martins;Centro de Ciências Sociais;2021-02-09 14:42:38
6768775515600364;Jaqueline Rossato;ROSSATO, J.;Centro de Ciências Sociais, Saúde e Tecnologia (CCSST);2021-02-09 12:18:45
7778475760218263;Antonio Luís Rodrigues Costa Júnior;"COSTA JÚNIOR, A. L. R.;RODRIGUES COSTA JÚNIOR, ANTÔNIO LUÍS;COSTA JÚNIOR, ANTONIO LUÍS RODRIGUES";"";2021-02-09 10:01:43
5507233104134545;Edinólia Portela Gondim;"GONDIM, E. P.;GONDIM, EDINÓLIA PORTELA;GONDIM, EDINOLIA PORTELA";Centro de Ciências Sociais;2021-02-09 10:59:53
5718340897020123;Marcus Baccega;"BACCEGA, Marcus.;BACCEGA, MARCUS";"";2021-02-09 13:45:11
6170689209803775;Monica Fontenelle Carneiro;"CARNEIRO, M. F.;CARNEIRO, MÔNICA FONTENELLE";Centro de Ciências Humanas;2021-02-09 14:22:57
3436612552318582;Rafael Alves Vidal de Lima;LIMA, R. A. V.;"";2021-02-09 14:51:45
2036359994281056;Jane Mello Lopes;"LOPES, J. M.;Lopes Jane Mello";Centro de Ciências Agrárias e Ambientais;2021-02-09 12:18:06
8893528640014570;Janilson dos Santos Coelho;"J. Santos Coelho;SANTOS COELHO, J.";Centro de Ciências;2021-02-09 12:18:25
4753235509344260;Janyele Lima Silva Everton;EVERTON, J. L. S.;Pró-Reitoria de Graduação;2021-02-09 12:18:44
2277258075147296;Monica Ribeiro Moraes de Almeida;ALMEIDA, M. R. M.;Campus Grajaú;2021-02-09 14:23:20
9303410317286054;Marcos Ferreira Silva;SILVA, M. F.;"";2018-05-01 13:15:53
3216864261742198;Adelson Alves De Oliveira Junior;"OLIVEIRA JUNIOR, A. A.;DE OLIVEIRA JUNIOR, ADELSON ALVES;ALVES DE OLIVEIRA-JÚNIOR, ADELSON";Hospital Universitário da Universidade Federal do Maranhão;2021-02-09 09:08:09
161699744000539;Igor Mendes de Araújo;ARAÚJO, I. M.;"";2019-05-03 18:40:17
7085054421011701;Edith Maria Barbosa Ramos;"RAMOS, E. M. B.;BARBOSA RAMOS, EDITH MARIA;RAMOS, EDITH MARIA BARBOSA;Edith Ramos;RAMOS, EDITH";Centro de Ciências Sociais;2021-02-09 11:00:12
9856652011091771;Janine Alessandra Perini;"PERINI, J. A.;ALESSANDRA PERINI, JANINE;PERINI, JANINE ALESSANDRA";Campus São BERNARDO;2021-02-09 12:18:28
4625914305792472;Janyeid Karla Castro Sousa;"SOUSA, Janyeid Karla Castro;Janyeid Karla Castro Sousa";Centro Tecnológico;2021-02-09 12:18:37
1523325793413985;Jeandson Correa Neves;NEVES, J. C.;"";2021-02-09 12:19:15
4608946243716220;Jose Lucio Alves Silveira;SILVEIRA, J. L. A.;Centro de Ciências Sociais;2021-02-09 12:47:06
878789376432327;Ana Catarina Sequeira Nunes Coutinho de Miranda;"MIRANDA, A. C.;Miranda, ANA C.;Miranda, Ana Catarina";"";2019-05-03 17:25:17
6139154166655451;Jefferson Ferreira da Silva Leite;LEITE, J. F. S.;"";2021-02-09 12:21:24
5184943074855298;Diêgo Vinnicyus Santos Rodrigues;"Diego V. S. Rodrigues;RODRIGUES, DIEGO VINNICYUS SANTOS";"";2021-02-09 10:54:36
9916960308606562;Maria de Fatima Almeida Braga;BRAGA, M. F. A.;Centro de Ciências Sociais;2018-05-01 13:19:20
2468528554511482;Edmar Pereira Marques;"MARQUES, E. P.;Marques, Edmar P.;MARQUES, EDMAR PEREIRA;MARQUES, E.P.;MARQUES, EDMAR";Centro Tecnológico;2021-02-09 11:00:53
4485991332506597;Edmilson Igor Bernardo Almeida;"ALMEIDA, E. I. B.;ALMEIDA, EDMILSON IGOR BERNARDO";Centro de Ciências Agrárias e Ambientais;2021-02-09 11:01:38
6075150594467928;Iassodara Oliveira Cavalcante Reis;REIS, I. O. C.;"";2021-02-09 12:05:37
9201645575133090;Acioli Fernandes da Gama;GAMA, A. F.;"";
4592887904839028;Jefferson Fontinele da Silva;SILVA, J. F.;Coordernação do Bacharelado em Ciências e Tecnologia - Campus Balsas;2021-02-09 12:21:25
6489991327669610;Andressa Oliveira Diniz;DINIZ, A. O.;"";2021-02-09 09:48:07
605726344902112;Adriana Carneiro Corrêa Nascimento;NASCIMENTO, A. C. C.;"";
4270542436468474;Adriana dos Santos Dutra;DUTRA, A. S.;"";
3908496030710998;Adrianna Karlen Campos Gonçalves;GONÇALVES, A. K. C.;"";
1216484483659706;Edson Firmino Viana de Carvalho;"CARVALHO, E. F. V.;Carvalho, Edson Firmino Viana;Carvalho, Edson F. V.;CARVALHO, EDSON F.V.;E.F.V. de Carvalho;DE CARVALHO, E. F. V.;DE CARVALHO, E.F.V.";Centro Tecnológico;2021-02-09 11:02:37
3854815719967025;Jeíse Pereira Rodrigues;RODRIGUES, J. P.;"";2021-02-09 12:21:27
9761030037562353;Marcos Antônio Macedo Muniz;MUNIZ, M. A. M.;Conselho Permanente de Pessoal Docente;2021-02-09 13:44:02
4778313001213808;Nathalia de Fátima Melo Lima;"LIMA, N. F. M.;LIMA, NATHÁLIA DE FÁTIMA M.";"";2021-02-09 14:28:38
6850288677200421;Albertine Mayara Amaral Silva;SILVA, A. M. A.;Unidade Materno Infantil;
8862133413979132;Alessandra de Jesus Diniz Lemos;LEMOS, A. J. D.;Centro Tecnológico;2021-02-09 09:18:59
5220915178947675;Alessandra Aparecida Martins Neves;NEVES, A. A. M.;"";2019-03-10 23:05:17
262269786251916;Alexandre Castro de Andrade;ANDRADE, A. C.;Faculdade de Medicina de Sobral;2019-03-10 23:05:46
8560730929338191;Tatiana Cotrim Serra Freire;FREIRE, T. C. S.;"";2021-02-09 15:47:24
6980026714293742;Agnaldo da Silva Guimarães Filho;GUIMARÃES FILHO, A. S.;Gabinete do Reitor;2021-02-09 09:14:43
5539849652027346;Cândido José Fernandes Aguiar;AGUIAR, C. J. F.;"";2021-02-09 10:16:57
9486119879810975;Jemmla Meira Trindade Moreira;"Trindade, Jemmla M.;Moreira, Jemmla Meira Trindade;TRINDADE, J. M.;Jemmla Meira Trindade Moreira";Centro Tecnológico;2021-02-09 12:21:32
1782280097034070;José Cláudio Araujo Cardoso;CARDOSO, J. C. A.;UNIDADE MATERNO INFANTIL;2021-02-09 12:39:01
41085284657642;Nair Portela Silva Coutinho;"COUTINHO, N. P. S.;COUTINHO, NAIR PORTELA SILVA";Centro de Ciências da Saúde;2021-02-09 14:26:15
3043318708065563;Alexandre Magno Morais Furtado;FURTADO, A. M. M.;"";2021-02-09 09:21:47
4311903498037293;Alex de Jesus Leite Pereira;PEREIRA, A. J. L.;"";2021-02-09 09:23:26
1569823381452061;Anna Carolina Souza Silva Santos;SANTOS, A. C. S. S.;"";2021-02-09 09:48:47
4157405186898932;Marcus Costa de Araujo;"ARAUJO, M. C.;ARAÚJO, MARCUS C.;Araújo Costa, Marcus;ARAUJO, M";"";2020-08-10 17:31:28
7649726665660336;Angel Eduardo Obispo Vásquez;"VÁSQUEZ A.E.O;Obispo Vasquez, A. E.;Obispo A. E.;Angel E. Obispo;Obispo, Angel E.;OBISPO, A. E.;OBISPO, A E";Centro Tecnológico;2021-02-09 09:48:17
2995453574622100;Anilton Bezerra Maia;"MAIA, A. B.;BEZERRA MAIA, ANILTON";Setor de Gestão de Processos e Tecnologia da Informação;2021-02-09 09:48:42
5660297823195759;Aline de Nazaré Costa dos Santos;SANTOS, A. N. C.;"";
9393260083220737;Rodrigo Gonçalves Dias;"DIAS, R. G.;DIAS, RODRIGO GONÇALVES;DIAS, R.";Laboratório de Genética e Cardiologia Molecular;2019-05-03 20:13:01
