"id";"nome_completo";"nome_citacoes";"nome_orgao";"updated_at"
3455007606963897;Luciana Salles Branco de Almeida;"Almeida LSB;Branco-de-Almeida, Luciana S;Branco-de-Almeida LS;Branco-de-Almeida, Luciana S.;SALLES BRANCO-DE-ALMEIDA, LUCIANA;BRANCO-DE-ALMEIDA, L.S.;BRANCO-DE-ALMEIDA, LUCIANA SALLES;BRANCO'DE'ALMEIDA, LUCIANA S.";Centro de Ciências da Saúde;2021-02-09 13:19:33
3336806286084085;Patrícia Kely Azambuja;AZAMBUJA, Patrícia K.;Centro de Ciências Sociais;2021-02-09 14:38:43
8318978424398466;Roberth Roner da Silva Alves;ALVES, R. R. S.;"";2020-12-02 22:14:07
1362398045749836;Rita de Cássia Oliveira;"OLIVEIRA, R. C.;OLIVEIRA, RITA DE CÁSSIA";Centro de ciências Humanas;2021-02-09 15:08:48
9219045010183113;Luciana Soares Santos;SANTOS, L. S.;"";2021-02-09 13:20:00
4306322037948988;Luciano Buonocore;"BUONOCORE, L.;BUONOCORE, LUCIANO";Centro Tecnológico;2021-02-09 13:21:18
7096083684539703;Luciano da Costa Pereira;PEREIRA, L. C.;"";2021-02-09 13:21:23
7180752938220497;Mateus Ribeiro Lage;"LAGE, M. R.;Lage, Mateus R.;LAGE, MATEUS RIBEIRO;RIBEIRO LAGE, MATEUS;LAGE, MATEUS";Coordenação do BICT - UFMA/Campus Balsas;2021-02-09 14:15:45
3395370000710275;Ronaldo Gomes Carmona;CARMONA, Ronaldo;Comissão Geral de Pós Graduação CGPG;2021-02-09 15:15:23
2676813572888508;Rodson Glauber Ribeiro Chaves;"CHAVES, R. G. R.;CHAVES, RODSON GLAUBER RIBEIRO CHAVES;CHAVES, R. R. G;CHAVES, RODSON GLAUBER RIBEIRO";Centro de Ciências da Saúde;2021-02-09 15:13:42
4359491829577261;Maura Cristina de Melo Silva;SILVA, M. C. M.;Centro de Estudos Básicos;2021-02-09 14:15:59
1124882784848117;Yndyra Nayan Teixeira Carvalho Castelo Branco;"CARVALHO, Y. N. T.;CARVALHO, Y.N.T.;CASTELO BRANCO, Y.N.T.C.;Yndyra Nayan Teixeira Carvalho Castelo Branco;Branco, Yndyra Nayan Teixeira Carvalho Castelo";Centro de Ciencias Agrarias e Ambientais (CCAA);2021-02-09 16:12:50
5559848269814596;Patrícia Silva Azevedo de Mendoza;"AZEVEDO, PATRÍCIA SILVA;AZEVEDO, P. S.;AZEVEDO, PATRICIA SILVA;MENDOZA, P.S.A;AZEVEDO, P.S;MENDOZA, PATRICIA SILVA AZEVEDO DE;MENDOZA, PATRÍCIA SILVA AZEVEDO DE";Centro Tecnológico;2021-02-09 14:40:55
963074858568241;Patrick Rademaker Burke;"BURKE, P. R.;BURKE, PATRICK RADEMAKER;BURKE, PATRICK;BURKE, PATRICK R.";Departamento de Otorrinolaringologia e Distúrbios da Comunicação Humana;2021-02-09 14:41:20
2031785468753203;Paula Cilene Alves da Silveira;"SILVEIRA, P. C. A. da;SILVEIRA, PAULA C.A.;DA SILVEIRA, PAULA CILENE ALVES";Departamento de OCeanografia e Limnologia;2021-02-09 14:41:26
9749842384027304;Adriana de Jesus Macau;MACAU, A. J.;Hospital Universitário da Universidade Federal do Maranhão;2021-02-09 09:11:34
7318884096236926;Luciano da Silva Façanha;"FAÇANHA, Luciano da Silva;FAÇANHA, Luciano S.;FAÇANHA, L.S.";Centro de Ciências Humanas/ PPGCult - DEFIL;2021-02-09 13:21:24
9764872485279363;Sebastião Barreto de Brito Filho;"BRITO FILHO, Sebastião Barreto de;DE BRITO FILHO, SEBASTIÃOBARRETO;BRITO-FILHO, SEBASTIÃO BARRETO DE;de Brito Filho SB";Centro de Ciências da Saúde;2021-02-09 15:31:53
2300567805828082;Luciano da Silva Quadros;QUADROS, L. S.;"";2021-02-09 13:22:14
7080097096930545;Lúcia Regina Moreira de Oliveira;OLIVEIRA, L. R. M.;Hospital Universitário Unidade Presidente Dutra;2021-02-09 13:22:31
9507590466760552;Mayara Cristina Pinto da Silva;"SILVA, M. C. P.;DA SILVA, MAYARA CRISTINA PINTO;SILVA, MAYARA C. P.;PINTO, M. C.;Mayara, C. Pinto;SILVA, MAYARA CRISTINA PINTO DA";Centro de Ciências da Saúde;2021-02-09 14:16:44
9387402910974928;Silvia Cristina Viana Silva Lima;LIMA, S. C. V. S.;Centro de Ciências da Saúde;2021-02-09 15:37:51
7896842311902691;Raquel Pires Costa;"COSTA, Raquel Pires;COSTA, RAQUEL";UFMA (Universidade Federal do Maranhão);2021-02-09 15:00:04
144699040321867;Rayron Lennon Costa Sousa;SOUSA, R. L. C.;"";2021-02-09 15:00:31
2338827280692565;Paulo César Alves de Carvalho;"CARVALHO, P. C. A.;Paulo César";Centro de Estudos Básicos;2021-02-09 14:42:39
7659367983809013;Paulo da Trindade Nerys Silva;"SILVA, P. T. N.;SILVA, Paulo da Trindade Nerys";Centro de Ciências da Saúde;2021-02-09 14:42:59
18671506508933;Lucinete Marques Lima;"LIMA, L. M.;LIMA, LUCINETE MARQUES";Centro de Ciências Sociais;2021-02-09 13:23:09
5076539366122449;Thiago Azevedo Feitosa Ferro;"FERRO, T. A. F.;FEITOSA FERRO, THIAGO AZEVEDO;Ferro, Thiago A. F.;FERRO, THIAGO A.F.;AZEVEDO FEITOSA FERRO, THIAGO;FERRO, THIAGO AZEVEDO FEITOSA";"";2021-02-09 15:51:11
3160626809778968;Lucio Antônio Alves de Macedo;MACEDO, Lucio Antônio Alves de;"";2021-02-09 13:23:20
656744291809067;Lúcio Flávio Trindade Avelar;AVELAR, L. F. T.;Pró-Reitoria de Gestão e Finanças;2021-02-09 13:23:37
7797029305620223;Melaine Mont'Alverne Lawall Silva;"LAWALL, Melaine de Almeida;LAWALL, M;de Almeida-Lawall, Melaine;LAWALL, MELAINE;Silva, Melaine M L";Centro de Ciências da Saúde;2021-02-09 14:18:25
872346755110236;Paulo Ricardo Costa Brito;BRITO, P. R. C.;Diretoria Interdisciplinar de Tecnologia na Educação (DINTE);2021-02-09 14:43:37
3013556982258366;Ludmila Bezerra da Silva;"SILVA, L. B.;Silva, L. B.;Silva, Ludmila B.;Silva, L. B. d.;SILVA, LUDMILA BEZERRA DA;DA SILVA, LUDMILA BEZERRA;DA SILVA, LUDMILA B.";Centro de Ciências da Saúde;2021-02-09 13:23:54
42423903693579;Soraia de Fátima Carvalho Souza;"SOUZA, S. F. C.;Souza, S. F. C.;Souza, Soraia de Fátima Carvalho;Sousa, Soraia de Fátima Carvalho;Soraia Fatima Carvalho Souza;Souza, Soraia Fatima Carvalho;Souza, SFC;DE FÁTIMA CARVALHO SOUZA, SORAIA;SOUZA, SFC;SOUSA, SFC";Centro de Ciências Biológicas e da Saúde;2020-08-10 18:43:30
9319762018688523;Sonia Rocha Santos Sousa;SOUSA, S. R. S.;Centro Tecnológico;2021-02-09 15:41:41
9295570180923844;Melissa de Almeida Melo Maciel Mangueira;"MANGUEIRA, M. A. M. M.;MANGUEIRA, MELISSA DE ALMEIDA MELO MACIEL";"";2021-02-09 14:18:44
1063068320150276;Surama Maria Bandeira de Sousa;SOUSA, S. M. B.;Hospital Universitário da Universidade Federal do Maranhão;2021-02-09 15:43:13
3327471801018108;Luecya Alves de Carvalho Silva;SILVA, L. A. C.;Centro de Ciências da Saúde;2021-02-09 13:24:06
6241790760285522;Tácio Giordano Santana Guimarães;"GUIMARÃES, T. G. S.;TACIO GIORDANO SANTANA GUIMARAES;GUIMARÃES, TÁCIO GIORDANO SANTANA";"";2021-02-09 15:44:37
158593617668245;Viturino Ribeiro da Silva;SILVA, V. R.;"";2020-08-10 18:57:47
8383229371389675;Paulo Roberto Mocelin;MOCELIN, Paulo Roberto;Hospital Universitário Presidente Dutra;2021-02-09 14:45:22
3355620397689015;Tamires Coimbra Bastos Borges;"BORGES, T. C. B.;BORGES, TAMIRES COIMBRA BASTOS";"";2021-02-09 15:46:13
7111745058057562;Luisa Maria Pereira Osorio da Fonseca;FONSECA, L. M. P. O.;CENTRO DE CIÊNCIAS HUMANAS;2021-02-09 13:24:38
1632495821323221;Tânia Maria Ferreira de Medeiros;MEDEIROS, T. M. F.;"";2021-02-09 15:46:24
4779581184278191;Luís Ângelo Macêdo Santiago;"SANTIAGO, L. Â. M.;SANTIAGO, LUÍS ÂNGELO MACÊDO;MACÊDO SANTIAGO, LUÍS ÂNGELO";Departamento de Medicina;2021-02-09 13:24:40
1304207320299200;Paulo Rogério Dias Pinheiro;"PINHEIRO, Paulo R. D.;Pinheiro, P. R. D.;PINHEIRO, P.R.D.";Curso Interdisciplinar em Ciência e Tecnologia;2021-02-09 14:45:32
9257200558945368;Paulo Sérgio Alves Cardoso;CARDOSO, P. S. A.;Centro de Ciências Agrárias e Ambientais - CCAA;2021-02-09 14:45:36
918449619157529;Thais Fonseca Nunes;NUNES, T. F.;Agência de Inovação UFMA;2021-02-09 15:49:45
6976773799985921;Luis Carlos Alves Venancio;"VENANCIO, L. C. A.;VENANCIO, LUIS C. A.;L Venancio;Venancio, L;Luis Alves Venancio;Venancio, Luis Alves";Centro Tecnológico;2021-02-09 13:24:43
3810756136201070;Perpétua do Socorro Silva Costa;"COSTA, P. S. S.;COSTA.P.d.S.S.;DO SOCORRO SILVA COSTA, PERPÉTUA";Centro de Ciências Sociais, Saúde e Tecnologia;2021-02-09 14:47:32
6141725405236646;Valdirene Pereira da Conceição;"CONCEIÇÃO, V. P.;PEREIRA DA CONCEIÇÃO, VALDIRENE;CONCEIÇÃO, VALDIRENE PEREIRA DA";Centro de Ciências Sociais;2021-02-09 15:54:15
1441293942618536;Abelina de Jesus Pãozinho Ericeira;ERICEIRA, A. J. P.;"";2021-02-09 09:05:34
6016850820500623;Luís Cláudio Nascimento da Silva;"SILVA, L. C. N.;da Silva, LuÃ­s ClÃ¡udio Nascimento;Nascimento da Silva, L. C.;Nascimento da Silva, Luís Cláudio;DA SILVA, LUÍS CLÁUDIO NASCIMENTO;Da Silva, Luís Cláudio Nascimento;Da Silva, Luís C. N.;Luis Claudio Nascimento da Silva;Da Silva, Luis Claudio Nascimento;Da Silva, Luís Claudio Nascimento;SILVA, LUÍS CLÁUDIO NASCIMENTO DA;da Silva LC;Luís C. N. da Silva;da Silva, Luís C. N.;da Silva, Luis C. N.;Luis C. N. da Silva;NASCIMENTO DA SILVA, LC;SILVA, LCN;DA SILVA, LCN;LCN DA SILVA;da Silva, LCN;LCN da SIlva;Da Silva, Luis;da Silva, Luis;Luis da Silva;SILVA, LUÍS C.N.;CLÁUDIO NASCIMENTO DA SILVA, LUÍS;Luis Nascimento da Silva;Nascimento da Silva, Luis;NASCIMENTO DA SILVA, LUÍS;DA SILVA, LUIS CLAUDIO NASCIMENTO;DA SILVA, LU?S CL?UDIO NASCIMENTO;SILVA, LUÍS C. N.;SILVA, LUÍS CLAUDIO NASCIMENTO DA;NASCIMENTO DA SILVA, LUÍS CLAUDIO;C. N. da Silva, Luís;C. N. Silva, Luís;SILVA, LUIS C.N.;DA SILVA, LUIS CLÁUDIO NASCIMENTO;SILVA, L C N;SILVA, LUIS CLAÚDIO NASCIMENTO DA";Associação de Ensino;2021-02-09 13:25:07
2131594060246155;Adão José Martins;MARTINS, A. J.;COORDENAÇÃO DO BCT (BACHARELADO EM CIÊNCIA E TECNOLOGIA);2021-02-09 09:07:17
3809927360236310;Mikhail Luczynski;LUCZYNSKI, M.;"";2021-02-09 14:21:32
1445288153044218;Pollyanna Pereira Santos;"SANTOS, P. P.;SANTOS, POLLYANNA PEREIRA;SANTOS, POLLYANNA P.";Centro de Ciências da Saúde;2021-02-09 14:49:29
7624205054443466;Adalberto Varão dos Santos;SANTOS, A. V.;"";2021-02-09 09:06:23
6707376027989566;Adalgisa de Souza Paiva Ferreira;"FERREIRA, A. S. P.;Ferreira, A.S.P.;Ferreira, Adalgisa de Souza Paiva;FERREIRA, ADALGISADE SOUZA PAIVA;Ferreira ADS;Ferreira Ade S;DE SOUZA PAIVA FERREIRA, ADALGISA;Ferreira adalgisa sousa ferreira;Ferreira adalgisa sousa paiva;FERREIRA, ADALGISA SOUSA PAIVA;FERREIRA, ADALGISA SP;Ferreira, Adalgisa de Sousa Paiva;DE SOUSA PAIVA FERREIRA, ADALGISA;FERREIRA, AS;PAIVA-FERREIRA, ADALGISA DE S.;FERREIRA, ADALGISA S.P.;FERREIRA&lt; ADALGISA P;FERREIRA, ADALGISA P;FERREIRA, ADALGISA P.;FERREIRA, ADALGISA;Ferreira, Adalgisa Paiva";Centro de Ciências da Saúde;2021-02-09 09:06:24
9485040610659823;Adalto Rodrigues Gomes dos Santos Filho;"GOMES, A. R.;GOMES, A;Gomes, A.;Gomes, A.R.;Gomes, A. R.;Gomes, Adalto;Gomes, A R;Gomes, Adalto R.;Gomes, A. R;Gomes, Adalto Rodrigues";Centro Tecnológico;2021-02-09 09:07:06
5011075833366525;Luis Fernando Bogea Pereira;"PEREIRA, L. F. B.;PEREIRA, LUIS FERNANDO BOGÉA;PEREIRA, LUÍS FERNANDO BOGÉA";COORDENAÇÃO DE ENFERMAGEM;2021-02-09 13:26:00
8190741131559224;Luis Henrique Pereira Vasconcelos;"VASCONCELOS, L. H. P.;Vasconcelos, Luis Henrique Pereira";"";2021-02-09 13:26:34
4957262830051547;Adeilton Pereira Maciel;"MACIEL, A. P.;Maciel, Adeilton P.;MACIEL, A;Maciel, Adeilton Pereira;Maciel, A.P.;PEREIRA MACIEL, ADEILTON;MACIEL, ADEILTON;P. M. Adeilton";Centro Tecnológico;2021-02-09 09:07:21
183040045095557;Ademir da Rosa Martins;MARTINS, Ademir;Centro de Ciências Sociais;2021-02-09 09:08:11
141868231910835;Adenilde Nascimento Mouchrek;"MOUCHREK, A. N;MOUCHRECK, ADENILDE NASCIMENTO;MOUCHREK, ADENILDE NASCIMENTO;Nascimento Mouchreck, Adenilde;R. NASCIMENTO, ADENILDE;N. MOUCHREK, ADENILDE";Centro Tecnológico;2021-02-09 09:08:16
7354243303158529;Adriana de Lima Reis Araújo;ARAÚJO , A. L. R.;Centro de Ciências Sociais;2021-02-09 09:11:35
3441922391793245;Adauto de Souza Lima Neto;LIMA NETO, A. S.;"";2021-02-09 09:07:18
984475664212794;Antonio Francisco de Sales Padilha;PADILHA, A. F. S.;Centro de Estudos Básicos;2021-02-09 09:59:04
1008844766307732;Adriana Barbosa Araújo;"ARAÚJO, A. B.;ARAÚJO, A.B.;ARAÚJO, ADRIANA;ARAÚJO, ADRIANA B.";Campus São Luís - Centro Histórico;2020-12-02 15:52:00
8515662719068936;Luís Henrique Serra;"SERRA, L. H.;SERRA, LUÍS HENRIQUE";Coordenação do Curso de Pedagogia, campus VII, Codó;2021-02-09 13:26:35
9015433724215330;Adriana Carla Oliveira Silva;SILVA, A. C. O.;Hospital Universitário da Universidade Federal do Maranhão;2021-02-09 09:10:06
7480727485255787;Luis Hernán Uribe Miranda;"URIBE MIRANDA, Luis;URIBE MIRANDA, LUIS";CCH - Departamento de Filosofia;2021-02-09 13:26:56
4160285898349649;Aderlânio da Silva Cardoso;"CARDOSO, A. S.;CARDOSO, ADERLANIO;da Silva Cardoso, Aderlânio";Coordenação do Bacharelado em Ciência e Tecnologia. Campus de Balsas.;2021-02-09 09:09:54
6346136596938814;Adriana Cavalcante Andrade;ANDRADE, A. C.;Hospital Universitário da Universidade Federal do Maranhão;2021-02-09 09:10:06
9266538187500466;Adna Gesarone Carvalho Ferreira Pinto;FERREIRA PINTO, A.G.C;Hospital Universitário da Universidade Federal do Maranhão;2021-02-09 09:10:04
8534667641706692;Luis Jorge Enrique Rivero Cabrejos;"RIVERO, L.;RIVERO, LUIS;CABREJOS, LUIS JORGE ENRIQUE RIVERO";Centro Tecnológico;2021-02-09 13:27:07
6493536511326004;Adriana Murad Fernandes;MURAD, A. L.;Centro Tecnológico;2021-02-09 09:13:41
1972734433460838;Rafael Fernandes Lopes;"LOPES, Rafael Fernandes;LOPES, R. F.;LOPES, R F;LOPES, RAFAEL F;FERNANDES LOPES, RAFAEL;LOPES, RAFAEL;LOPES, R.;LOPES, R";Centro Tecnológico;2021-02-09 14:52:41
8657995976796249;Adriana Lindoso Duarte;DUARTE, A. L.;Hospital Universitário da Universidade Federal do Maranhão;2021-02-09 09:12:35
7780911853153462;Adriana Moura Maia;MAIA, A. M.;"";2021-02-09 09:13:40
6977724359369513;Adriana Mourão Gonçalves;GONÇALVES, A. M.;"";2021-02-09 09:13:40
4584365434092119;Luís Jorge Mesquita de Jesus;"JESUS, L. J. M.;JESUS, L.J.M.;JESUS, LUÍS;LUÍS JORGE MESQUITA DE JESUS;(Org.) JESUS, Luís Jorge Mesquita de;(pref.) JESUS, Luís Jorge Mesquita de;JESUS, Luís Jorge Mesquita de";Associação de Ensino;2021-02-09 13:27:22
4394413983541820;Afonso Gomes Abreu Junior;"ABREU, A. G.;Abreu, Afonso G.;Abreu, AG;Abreu, Afonso Gomes";Programa de Pós-Graduação em Biologia Microbiana;2020-12-02 15:57:28
2635723355174304;Agnaldo Pereira Libório;LIBÓRIO, Agnaldo Pereira;"";2020-12-02 15:58:05
9169548885170340;Afonso de Carvalho Nora;NORA, A. C.;"";2021-02-09 09:14:42
7666320730544018;Agostinho Lázaro Pimenta Filho;PIMENTA FILHO, A. L.;"";2021-02-09 09:14:47
1037029232433968;Afonso Pena Costa do Amaral Filho;AMARAL FILHO, A. P. C.;Centro Tecnológico;2021-02-09 09:14:42
6152212644682366;Alberto Pedrosa Dantas Filho;DANTAS FILHO, A. P.;Centro de Ciências Sociais;2021-02-09 09:16:06
4476001314220198;Alair Reis Araujo;ARAUJO, A. R.;"";2021-02-09 09:15:04
5427561523105187;Alana Brito Barbosa;BARBOSA, A. B.;Projeto Atlas Linguístico do Maranhão;2020-12-02 15:58:29
3002049242487940;Luiza Carvalho de Oliveira;OLIVEIRA, Luiza Carvalho de;Núcleo de Educação a Distância;2021-02-09 13:27:56
1445205757349785;Alana Lislea de Sousa;"SOUSA, A. L.;SOUSA, ALANA LISLEA;SOUSA, ALANA LISLEA DE;DE SOUSA, ALANA LISLEA;SOUSA, ALANA L.;SOUSA, A.L.;DE SOUSA, ALANA L.";Unidade de Estudos de Medicina Veterinária;2020-12-02 15:58:59
6253527692814293;Alana de Araújo Oliveira Meireles Teixeira;"OLIVEIRA, Alana de Araújo;OLIVEIRA, ALANA";"";2021-02-09 09:15:30
720612245004100;Alan Bezerra Lima;"Alan Lima;Alan B. Lima";"";2021-02-09 09:15:32
1660039142489971;Alan Bezerra Ribeiro;"RIBEIRO, Alan Bezerra;RIBEIRO, ALAN BEZERRA;RIBEIRO, ALAN B.";Centro de Ciências Sociais, Saúde e Tecnologia - Campus II;2021-02-09 09:15:33
3065721271754277;Alan Hass;HASS, A.;Neurocirurgia;2021-02-09 09:15:41
9948541592600727;Alcina Vieira de Carvalho Neta;"CARVALHO NETA, A. V.;CARVALHO NETA, A;de Carvalho Neta, Alcina Vieira;CARVALHO NETA, ALCINA VIEIRA;CARVALHO NETA, ALCINA VIEIRA DE";Centro de Ciencias Exatas e Naturais;2020-12-02 16:00:09
8137042356481507;Alda Margarete Silva Farias Santiago;FARIAS, A. M. S.;"";2021-02-09 09:17:47
4292875123871571;Aldifran Ferreira da Silva;SILVA, A. F.;Centro de Ciências da Saúde;2021-02-09 09:18:05
6882715941373103;Luiz Alberto Alves Couceiro;COUCEIRO, L. A. A.;Centro de Estudos Básicos;2021-02-09 13:28:10
3903158114502893;Aldeides dos Santos Pereira;PEREIRA, A. S.;DIVISÃO DE ENFERMAGEM;2021-02-09 09:17:48
4788996065103307;Aldicléya Lima Luz;LUZ, A. L.;"";2021-02-09 09:18:00
1610034019712607;Aldir Araújo Carvalho Filho;CARVALHO FILHO, A.;Centro de Ciências Humanas / Departamento de Filosotia;2021-02-09 09:18:34
4561662950186599;Aldo Aoyagui Gomes Pereira;"Pereira, A. A. G.;PEREIRA, AOYAGUI GOMES PEREIRA;PEREIRA, Aldo Aoyagui Gomes";"";2021-02-09 09:18:41
3229006130358077;Alessandra Belfort Barros;BARROS, Alessandra Belfort;"";2021-02-09 09:18:53
7484787044651661;Alessandra Costa de Sales Muniz;"MUNIZ, A. C. S.;COSTA DE SALES MUNIZ, ALESSANDRA";Hospital Universitário da Universidade Federal do Maranhão;2021-02-09 09:18:56
2015365293258221;Antônio Jeferson de Deus Moreno;"MORENO, A. J. D.;Moreno, Antonio Jeferson de Deus;MORENO, A.J.D.";Centro Tecnológico;2021-02-09 09:59:23
2057530058619654;Alécio Matos Pereira;"PEREIRA, A. M.;PEREIRA, ALECIO MATOS";Centro de Ciencias Agrarias e Ambientais (CCAA);2021-02-09 09:18:43
3341628098886877;Alessandra Fialho Nascimento;NASCIMENTO, A. F.;"";2021-02-09 09:19:11
4386311865832152;Alessandra Juliana Caumo;"CAUMO, A. J.;CAUMO, ALESSANDRA";Centro de Ciências Sociais;2021-02-09 09:19:13
1866931907027959;Aline Mara de Almeida Rocha;ROCHA, A. M. A.;"";2021-02-09 09:25:28
8425084108120335;Antonio José Silva Oliveira;"ANTONIO JOSÉ SILVA OLIVEIRA, OLIVEIRA, A. J. S. OU OLIVEIRA, A. J.;OLIVEIRA, ANTONIO JOSÉ SILVA;Antonio Jos´ Silva Oliveira;Oliveira AJ;Oliveira AJS";Centro Tecnológico;2021-02-09 10:01:16
1435575265321591;Alessandra Karla Oliveira Amorim Muniz;"AMORIM, AKOA;MUNIZ AKOA;MUNIZ, A. K. O. A.;AMORIM, A. K. O.;KARLA OLIVEIRA AMORIM MUNIZ, ALESSANDRA";"";2021-02-09 09:19:16
2510444490695173;Antonio José da Silva;"SILVA, Antonio J. da;SILVA, ANTONIO JOSÉ DA;DA SILVA, ANTONIO JOSÉ";Cento de Ciências Exatas e Tecnologias;2021-02-09 10:00:35
5225588855422632;Alexandre César Muniz de Oliveira;"OLIVEIRA, A. C. M.;Cesar Muniz de Oliveira, Alexandre;Oliveira, Alexandre C.M.;DE OLIVEIRA, ALEXANDRE CESAR MUNIZ;OLIVEIRA, ALEXANDRE C;OLIVEIRA, ALEXANDRE C.;DE OLIVEIRA, ALEXANDRE CÉSAR MUNIZ;OLIVEIRA, ALEXANDRE C. M.;MUNIZ DE OLIVEIRA, ALEXANDRE CESAR;CESAR, ALEXANDRE";Centro Tecnológico;2021-02-09 09:19:54
3526984734640845;Aline Maria Santos Farias;FARIAS, Aline Maria Santos;"";2021-02-09 09:25:29
5113457092920989;Aline Sampieri Tonello;"TONELLO, A. S.;Tonello, AS;TONELLO, AS;BENAZZI, AST;BENAZZI, A.S.T;Benazzi, AST;Aline Sampieri Tonello;Tonello, Aline Sampieri";Centro de Ciências da Saúde;2021-02-09 09:25:35
2306739245123261;Ana Cléa Feitosa Pestana;PESTANA, Ana C. F.;"";2021-02-09 09:30:41
1596868275681473;Nádia Prazeres Pinheiro Carozzo;"PINHEIRO, Nádia Prazeres;PINHEIRO-CAROZZO, Nádia Prazeres;PRAZERES PINHEIRO-CAROZZO, Nádia";Centro de Ciências Humanas - CCH;2021-02-09 14:24:35
3625483363156975;Nádia Selene Guimarães Costa Vendruscolo;Vendruscolo, Nádia Selene Guimarães Costa;Centro de Ciências da Saúde;2021-02-09 14:24:44
2783679274184244;Alexandre Guida Navarro;"NAVARRO, A. G.;NAVARRO, ALEXANDRE GUIDA";Centro de Ciências Humanas Departamento de História;2021-02-09 09:21:16
8233629667006297;Alexandrina Colins Martins;MARTINS, A. C.;"";2021-02-09 09:23:09
9491943053279706;Alex Fabiano Santos Bezerra;BEZERRA, A. F. S.;Centro de Ciências da Saúde;2021-02-09 09:23:34
3844682340433693;Alexsandra Jácome Castelo Gomes Torres;TORRES, A. J. C. G.;"";2021-02-09 09:24:10
347940613470051;Luiz Antonio de Souza Ribeiro;"RIBEIRO, L. A. S.;de Souza Ribeiro, L.A.;de S. Ribeiro, L.A.;RIBEIRO, LUIZ;RIBEIRO, LUIZ ANTONIO DE SOUZA;de S. Ribeiro, Luiz A.;DE SOUZA RIBEIRO, LUIZ ANTONIO;ANTONIO DESOUZA RIBEIRO, LUIZ;DE S. RIBEIRO, L. A.;Ribeiro, Luiz A. de S.;RIBEIRO, LUIZ A. S.;RIBEIRO, LUIZ A DE S.;RIBEIRO, L.A.S.;ANTONIO DE SOUZA RIBEIRO, LUIZ;DE SOUZA RIBEIRO, LUIZ A.";Centro Tecnológico;2021-02-09 13:28:27
9088557436447127;Alice Bianca Santana Lima;LIMA, A. B. S.;"";2021-02-09 09:24:36
611345840117397;Aline Alvares Melo;"MELO, ALINE A.;MELO, ALINE ALVARES";PRO-REITORIA DE RECURSOS HUMANOS;2021-02-09 09:24:51
3622212105238098;Aline Aparecida Angelo;ANGELO, Aline Aparecida;"";2021-02-09 09:24:55
2792856181281701;Aline Delgado Barbosa;BARBOSA, A. D.;"";2021-02-09 09:25:05
9255582950041889;Aline Gomes Bittencourt;"BITTENCOURT, A. G.;BITTENCOURT, A.G.;BITTENCOURT, ALINE GOMES;BITTENCOURT, ALINE;BITTENCOURT, ALINE GOMEZ";"";2021-02-09 09:25:09
4556382304706522;Nailde Melo Santos;SANTOS, N. M.;Hospital Universitário da Universidade Federal do Maranhão;2021-02-09 14:25:39
41062092826651;Alícia Valéria dos Santos Zaranza de Carvalho;CARVALHO, A. V.S.Z.;"";2021-02-09 09:24:45
3945572418651068;Aline Silva Andrade Nunes;"NUNES, Aline Silva Andrade.;NUNES, ALINE SILVA ANDRADE";Instituto Federal do Maranhão - Campus São José de Ribamar;2020-12-02 16:10:58
2566366444368508;Alisson Mota de Aguiar;AGUIAR, A. M.;"";2021-02-09 09:26:41
6839139546415569;Almir Ferreira da Silva Junior;"SILVA JUNIOR, A. F.;SILVA JUNIOR, ALMIR FERREIRA DA";Centro de Ciências Humanas;2021-02-09 09:27:41
4424039144929179;Luiz Eduardo Neves dos Santos;"SANTOS, Luiz Eduardo Neves dos.;DOS SANTOS, LUIZ EDUARDO NEVES;SANTOS, L.E.N.;SANTOS, LUIZ EDUARDO NEVES DOS";Centro de Ciências Humanas, Naturais, Saúde e Tecnologia (CCHNST) -Pinheiro;2021-02-09 13:28:54
8828099020287823;Raimundo Nunes Costa;COSTA, R. N.;"";2021-02-09 14:57:59
6664045074505239;Alyson Bruno Fonseca Neves;"NEVES, Alyson B. F.;F. N., Alyson Bruno;Alyson Bruno;NEVES, A. B. F.";"";2021-02-09 09:28:47
5963903220182400;Amalia Carolina Frota Sales Ribeiro;SALES, A. C. F.;"";2021-02-09 09:29:00
8978522306451266;Allan Kardec Araujo Alves;ALVES, A. K. A.;"";2021-02-09 09:26:44
853843417402029;Allinger Lima Medeiros;MEDEIROS, A. L.;Núcleo de Tecnologia de Informação;2021-02-09 09:27:39
7786089912466038;Aloma Samira da Cunha Martins SILVA;SILVA, A.S.C.M;Biblioteca Central;2021-02-09 09:28:22
5298630482041321;Altenize dos Santos Cordeiro Oliveira;OLIVEIRA, A. S. C.;"";2020-12-02 16:13:11
2751713874701874;Aluisio da Silva Oliveira;"OLIVEIRA, A. S.;OLIVEIRA, ALUÍSIO S.;OLIVEIRA, ALUÍSIO DA SILVA";Biotério Central;2021-02-09 09:28:25
1179786436470391;Luiz Vieira de Araujo Neto;ARAUJO NETO, L. V.;"";2021-02-09 13:30:13
1169025650147386;Aluísio Do RÊGO Mello Filho;MELO FILHO, A. R.;"";2021-02-09 09:28:27
9598775688999795;Nathalya dos Santos Martins;"MARTINS, N.S;MARTINS, NATHÁLYA DOS SANTOS;NATHÁLYA DOS S. MARTINS;MARTINS, NATHÁLYA DOS S.;MARTINS, NS;MARTINS DE OLIVEIRA, NATHÁLYA;MARTINS DE OLIVEIRA, NS";Unidade de Estudos de Medicina Veterinária;2021-02-09 14:28:42
465963362191690;Nayara Nojosa Aguiar;AGUIAR, N. N.;CCET - Curso de Engenharia Quimica;2021-02-09 14:29:09
4782161324909358;Raquel Gomes Noronha;"NORONHA, R. G.;NORONHA, RAQUEL GOMES;NORONHA, Raquel;NORONHA, R.";Centro Tecnológico;2021-02-09 14:59:42
8925825603138594;Ana Beatriz Menezes Chaves;CHAVES, A. B. M.;"";2021-02-09 09:29:42
6863758885653196;Ana Beatriz Silva Rêgo;RÊGO, A. B. S.;Centro de Ciências Sociais, Saúde e Tecnologia (CCSST) - Imperatriz;2021-02-09 09:29:46
6579626696152310;Ana Carla Araújo Arruda;ARRUDA, A. C. A.;"";2021-02-09 09:29:47
7641978829218060;Ana Carolina Abrão Neri;NERI, A. C. A.;Campus Barreirinhas;2021-02-09 09:29:47
9328193218432476;Ana Flávia Almeida dos Santos;SANTOS, A. F. A.;"";2021-02-09 09:32:58
8281621481381083;Rarielle Rodrigues Lima;"LIMA, Rarielle Rodrigues;LIMA, R. R.";"";2021-02-09 15:00:15
6692263043932463;Amanda Namíbia Pereira Pasklan;"PEREIRA, A. N. S.;PASKLAN, A.N.P.;PEREIRA PASKLAN, AMANDA NAMIBIA;PEREIRA PASKLAN, AMANDA NAMÍBIA;AMANDA NAMIBIA PEREIRA PASKLAN;Amanda Namíbia Pereira PASKLAN;PASKLAN, AMANDA NAMIBIA PEREIRA";"";2021-02-09 09:29:23
1781910519053297;Amanda Suellen Chagas Silva;SILVA, A. S. C.;"";2021-02-09 09:29:39
7622496980449901;Amaury Araujo Santos;SANTOS, A. A.;Pró-Reitoria de Pesquisa e Pós-Graduação;2021-02-09 09:29:41
6008657066776260;Amudsen Bonifácio;Amudsen, S B;"";2021-02-09 09:29:41
1565565441328728;Ana Caroline Ramos Rocha;ROCHA, A. C. R.;"";2021-02-09 09:30:16
3512111386096660;Ana Claudia Pinho de Carvalho;CARVALHO, A. C. P.;"";2021-02-09 09:30:36
1118183102341143;Ana Cláudia de Sousa Alves;SOUSA, A. C.;"";2020-12-02 16:15:35
5651616479126344;Luzeli Moreira da Silva;"da SILVA, L. M.;da Silva, Luzeli M.;da Silva, L.M.;DASILVA, L;Silva, L. M.";Centro de Ciências Sociais Saude e Tecnologia;2021-02-09 13:30:14
2824015958328171;Luzenir Mesquita Freitas Barros do Bonfim;BONFIM, L. M. F. B.;"";2021-02-09 13:30:28
4187892500832764;Ana Caroline Silva Caldas;CALDAS, A. C. S.;Colégio Universitário;2021-02-09 09:30:17
7504603023973452;Ana Caroline Silva Gama Maciel;"GAMA, Ana Caroline Silva;Gama, A.C.S.";Centro de Ciências da Saúde;2021-02-09 09:30:21
381444626861942;Ana Cecília Vasconcelos Loayza;LOAYZA, A. C. V.;Centro de Ciências Sociais;2021-02-09 09:30:30
4929653552819763;Ana Cristhine Algarves Ribeiro Aragão;RIBEIRO, A. C. A.;Centro Tecnológico;2021-02-09 09:30:59
9524897911810266;Maciel Cover;"COVER, M.;COVER, MACIEL";Campus Universitário de Tocantinópolis;2021-02-09 13:31:07
9715791832414001;Regiane Ferreira Bastos;BASTOS, R. F.;Hospital Universitário da Universidade Federal do Maranhão;2021-02-09 15:01:10
3444570605688961;Regiane Silva Pinheiro;"PINHEIRO, R. S.;Pinheiro, Regiane Silva;PINHEIRO, REGIANE S.";Centro de Tecnologia;2021-02-09 15:01:10
7124149481759668;Ana Cristina Frazão;FRAZÃO, A. C.;"";2021-02-09 09:31:07
6750997997845335;Emnielle Pinto Borges Moreira;"BORGES, Emnielle Pinto;Moreira, Emnielle Pinto Borges";Colégio Universitário da UFMA;2021-02-09 11:17:39
7292041691279526;Ana Laura Alves de Araujo;ARAUJO, A. L. A.;Campus Balsas;2021-02-09 09:34:29
6309016632749163;Maira Silva Ferreira;"FERREIRA, M. S.;FERREIRA, M;FERREIRA, MAIRA S.;FERREIRA, MAIRA;FERREIRA, MAIRA SILVA";Centro de Ciências Exatas e Tecnologia;2021-02-09 13:31:40
