"id";"nome_completo";"nome_citacoes";"nome_orgao";"updated_at"
6762303732888522;Geruza de Arruda Vasconcelos;VASCONCELOS, Geruza de Arruda;Hospital Universitário;2021-02-09 11:46:56
2350051548673474;Marcela Karine Lobato Muniz;MUNIZ, M. K. L.;"";2021-02-09 13:33:27
1327998205561932;Paula Vitória Costa Gontijo;"GONTIJO, P. V. C.;GONTIJO, PAULA VITÓRIA COSTA";"";2020-05-18 21:57:51
8639615360063699;Gilberto de Sousa Moura;MOURA, G. S.;"";2021-02-09 11:50:04
851056816534082;Teresa Cristina Vieira da Silva Martins;MARTINS, T. C. V. S.;Hospital Universitário Bettina Ferro de Souza;2021-02-09 15:48:56
8146440308240284;Gregory Ramon Bandeira da Silva;SILVA, G. R. B.;"";2019-05-03 18:35:44
4204143169187303;Danielly Nunes de Matos;MATOS, D. N.;INEURON;2021-02-09 10:45:21
3041653131836147;Tereza Cristina Monteiro de Melo Prazeres;MELO, T. C. M.;Hospital Universitário da Universidade Federal do Maranhão;2021-02-09 15:48:56
2377170032365026;Elson Fonseca Costa;COSTA, E. F.;Hospital Universitário da Universidade Federal do Maranhão;2021-02-09 11:14:39
3723017316619074;John Kennedy Ferreira;FERREIRA, J. K.;"";2021-02-09 12:30:29
3835064528047533;Marcos André Rocha Cerveira;CERVEIRA, M. A. R.;"";2021-02-09 13:42:59
3593699700133567;Patrícia Rosa Santana Guzmán;GUZMÁN, Patrícia Rosa Santana;"";2021-02-09 14:40:54
6041489096857931;Larissa Dias Serra;SERRA, L. D.;"";2021-02-09 13:03:11
2196160416333021;Guilherme Carneiro Aguiar;"AGUIAR, G. C.;Aguiar, Guilherme Carneiro";"";2019-05-03 18:35:46
2242681171421719;Gustavo Araujo de Andrade;"ANDRADE, G. A.;ANDRADE, GUSTAVO";Campus Balsas;2021-02-09 11:57:56
760406534248737;Rosangela Cipriano de Souza;"Cipriano R;Souza RC;Monteiro RC;CIPRIANO, ROSÂNGELA";Centro de Ciências da Saúde;2021-02-09 15:18:49
6202220630418688;Rosangela de Jesus Santos Moura;SANTOS, R. J.;"";2021-02-09 15:18:53
1185952576258491;Manoel da Conceição Silva;SILVA, M. C.;Centro de Ciências Sociais;2021-02-09 13:32:03
2242204745130086;Marcela Patricia Macedo Belo Fort;"BELO, MPM;Belo, Marcela Patricia Macêdo;BELO, MARCELA PATRÍCIA MACÊDO";"";2021-02-09 13:33:28
5986696616450634;Paulo de Tasso Alves Martins;MARTINS, PAULO DE TASSO A.;Centro de Ciências Humanas;2021-02-09 14:43:14
818824277965456;Paulo cledson Barroso RAMOS;RAMOS, P. C. B.;"";
4976533025440107;Felipe Rodrigues Vaz;VAZ, F. R.;"";2019-05-03 18:19:29
906644392930573;Alessandra de Magalhães Campos Garcia;"GARCIA, A. M. C.;CAMPOS, A. M.;GARCIA, A.M.C.;Garcia Alessandra;GARCIA, ALESSANDRA;GARCIA, ALESSANDRA M.C.";Centro de Ciências da Saúde;2021-02-09 09:19:00
4270381678250146;Francisca Thamires Lima de Sousa;SOUSA, F. T. L.;"";2017-11-27 11:16:17
5237858247274411;Paulo do Nascimento Sousa;SOUSA, P. N.;"";2021-01-25 19:18:47
7341633951243115;Aldivam do Carmo Albuquerque;ALBUQUERQUE, A. C.;"";2020-05-18 17:35:35
8166600350108596;Raimunda de Fátima Pachêco Figueiredo;FIGUEIREDO, Raimunda de Fátima Pachêco;"";2018-05-01 13:46:42
4192270254798284;Gizele Saraiva de Sousa;SOUSA, G. S.;"";
5098909246333951;Hivana Patricia Melo Barbosa Dall'Agnol;"DALL'AGNOL, H.;DALL'AGNOL, H;MELO, H. P. B.;Melo Barbosa, H.P.;Barbosa, H.P;Barbosa, Hivana Patricia Melo;BARBOSA, HIVANA P;DALL'AGNOL, HIVANA PMB;MELO BARBOSA DALL?AGNOL, HIVANA;DALL`AGNOL, HIVANA;DALL?AGNOL, HIVANA;BARBOSA, HIVANA";Centro de Ciências da Saúde;2021-02-09 12:04:13
5457124643164673;Manoel Rosa Gomes;GOMES, M. R.;"";2021-02-09 13:32:49
2402404342296301;Nilton José de Almeida Costa;COSTA, N. J. A.;Centro de Ciências Biológicas e da Saúde/Departamento de Morfologia;2019-12-16 00:19:35
6572389980946800;Marcelo Domingos Sampaio Carneiro;"CARNEIRO, M. D. S.;CARNEIRO, Marcelo S.;CARNEIRO, M.S.;CARNEIRO, MARCELO SAMPAIO;CARNEIRO, Marcelo D.S.;Marcelo Sampaio Carneiro;CARNEIRO, Marcelo Sampaio;SAMPAIO CARNEIRO, Marcelo";Centro de Ciências Humanas;2021-02-09 13:35:23
8207297437922747;Ivan Hudson Cassimiro Lino;LINO, I. H. C.;"";2019-05-03 18:43:31
1287732267771198;Giuliano Lima Alves;ALVES, G. L.;"";2021-02-09 11:54:03
5292294322449997;Evandro Bessa de Lima Filho;LIMA FILHO, E. B.;"";2018-05-01 12:09:55
9828015217384592;Hugo Paulo Cardoso Furtado dos Santos;FURTADO DOS SANTOS, H. P. C.;Centro de Ciências Sociais;2021-02-09 12:05:05
5822293050229432;Leonardo Bernardes Taverny de Oliveira;"OLIVEIRA, L. B. T.;OLIVEIRA, LEONARDO BERNARDES TAVERNY DE;OLIVEIRA, L;DE OLIVEIRA, LEONARDO BERNARDES TAVERNY";"";2021-02-09 13:07:00
2509454037637317;Manuela Maria Cyrino Viana;VIANA, M. M. C.;Centro de Ciencias Humanas;2021-02-09 13:33:09
1059798585946068;Manuel Alfredo Araujo Medeiros;"MEDEIROS, Manuel Alfredo Araujo;Medeiros, Manuel Alfredo;Manuel A. Medeiros";Centro de Ciências Biológicas e da Saúde;2021-02-09 13:32:55
4280091882843054;Helma de Souza-Pinto;"SOUZA-PINTO, H.;SOUZA-PINTO, Helma de";"";2021-02-09 12:01:04
10007900506424;Hugo Leonardo Melo Dias;DIAS, H.L.M.;Centro de Ciências da Saúde;2021-02-09 12:04:59
4536312097540771;Humberto Oliveira Serra;"SERRA, H. O.;SERRA, HUMBERTO OLIVEIRA;SERRA, HUMBERTO DE OLIVIERA;SERRA, HUMBERTO DE OLIVEIRA;OLIVEIRA SERRA, HUMBERTO";Centro de Ciências da Saúde;2021-02-09 12:05:11
9889583472698132;Leonardo Tadeu Boaes Mendonça;"MENDONÇA, L. T. B.;MENDONÇA, LEONARDO T.B;Leonardo Tadeu Boaes de Mendonça";"";2021-02-09 13:08:52
2887534117826345;Guilherme Aragão Bringel;BRINGEL, G. A.;"";2019-03-11 00:15:16
5126988264052541;Mara Silvia Pinheiro Cutrim;CUTRIM, M. S. P.;Hospital Universitário da Universidade Federal do Maranhão;2021-02-09 13:33:17
4210874297039837;Heliene Leite Ribeiro Porto;PORTO, H. L. R.;Centro de Ciências Biológicas e da Saúde;2019-12-15 22:21:34
8448133837533341;Marceli Muniz;MUNIZ, M.;"";2021-02-09 13:33:30
6648080593915062;Igor Gastal Grill;"GRILL, I. G.;GRILL, IGOR GASTAL";"";2021-02-09 12:05:44
6776760517996378;Vanessa Camila da Silva;"da SILVA, V. C.;SILVA, VANESSA CAMILA;DA SILVA, VANESSA CAMILA;SILVA, V.C.";Centro de Ciências da Saúde;2021-02-09 15:57:56
1316023086816223;Álvaro Roberto Pires;PIRES, Á. R.;Centro de Ciências Humanas;2019-12-15 20:24:46
697776124558320;Davi Galhardo Oliveira Filho;GALHARDO, Davi;"";2019-12-15 21:20:44
5038546995922111;Alexandre Nogueira Facundo;FACUNDO, A. N.;"";2019-12-15 20:19:54
6117253366481322;Julia Brandao de Paiva Teixeira Custodio;CUSTODIO, J. B. P. T.;"";2018-05-01 12:52:29
6337040360157269;Anna Caroline Corrêa Mendes;MENDES, A. C. C.;"";2021-02-09 09:48:48
3563486912777691;Ilisandra Zanandrea;"ZANANDREA, Ilisandra;Zanandrea, Ilisandra";Centro de Ciências da Saúde;2021-02-09 12:06:48
9032198192954149;Paulo Sergio Marques dos Santos;"SANTOS, P. S. M.;Santos, P. S. M.;Santos, P.S.M.";Campus Ministro Reis Velloso;2021-02-09 14:45:42
3768359508641719;Silvia Maria Lima da Silva;SILVA, S. M. L.;Hospital Universitário da Universidade Federal do Maranhão;2021-02-09 15:38:11
6434212774237352;Alexandra Martins dos Santos Soares;"SOARES, A. M. S.;Soares, Alexandra Martins dos Santos;SOARES, ALEXANDRA M.S.;DOS SANTOS SOARES, ALEXANDRA MARTINS;SOARES, ALEXANDRA M. S.;SANTOS SOARES, ALEXANDRA MARTINS";CCET;2021-02-09 09:19:33
4139430895226572;Liduina Maria da Conceição Castelo Branco;BRANCO, L. M. C. C.;"";
6571592702394471;Alexandre Batista Penido;"PENIDO, A. B.;PENIDO, ALEXANDRE BATISTA";Centro de Ciências Sociais, Saúde e Tecnologia;2021-02-09 09:19:51
8076487547964658;Lêda Gonçalves de Freitas;FREITAS, L. G.;Curso de Pedagogia;2018-04-18 15:25:14
651158838663848;Hénderson Fontes de Sousa;SOUSA, H. F.;"";2021-02-09 12:01:37
6733654907197313;Ilma Maria de Oliveira Silva;SILVAL, I. M. O.;Centro de Estudos Superiores de Imperatriz;2021-02-09 12:07:20
4483522902912467;Ilse Gomes Silva;SILVA, Ilse Gomes;Centro de Ciências Humanas;2021-02-09 12:07:29
8319485379167973;Alexandre Peixoto Faria Nogueira;"NOGUEIRA, Alexandre Peixoto Faria;PEIXOTO, Alexandre";Centro de Ciências Sociais, Saúde e Tecnologia;2021-02-09 09:21:51
6628313480144303;Ilza do Socorro Galvão Cutrim;"CUTRIM, I. G.;CUTRIM, Ilza Galvão";Centro de Estudos Básicos;2021-02-09 12:07:47
1177470998037957;Gleiciane Brandão Carvalho;CARVALHO, G. B.;"";2020-08-10 16:22:52
5672071201353574;Rafael Campos Quevedo;QUEVEDO, R. C.;Centro de Estudos Básicos;2021-02-09 14:51:47
6706723572057171;Célia Maria da Motta;MOTTA, C. M.;"";2019-05-03 17:50:53
7574037011952874;Ilzeni Silva Dias;"DIAS, I. S.;DIAS, ILZENI SILVA";Centro de Ciências Sociais;2021-02-09 12:08:11
4124941157086257;Roberto Santos Ramos;RAMOS, Roberto Santos;campus Pinheiro;2021-02-09 15:11:04
2490801607918261;Alexandre Zarate Maciel;"MACIEL, A. Z.;Maciel, Alexandre Zarate";curso de Comunicação Social-Jornalismo;2021-02-09 09:22:59
1159471817182746;Heloisa Silva Nascimento;NASCIMENTO, H. S.;Centro de Ciências da Saúde;2019-05-03 18:37:38
5280441501940287;Marcia Milena Galdez Ferreira;"FERREIRA, Marcia Milena Galdez;FERREIRA, MARCIA MILENA GALDEZ";"";2018-01-16 16:36:27
8671328228112724;Bruno Mileno Magalhães de Carvalho;CARVALHO, B. M. M.;Centro de Ciências da Saúde;2021-02-09 10:14:48
6388318043492827;Inez Maria Leite da Silva;"SILVA, I. M. L.;SILVA, INEZ";Centro de Ciências Exatas e Tecnologia/Departamento de Desenho e Tecnologia;2021-02-09 12:08:27
6962905424742068;Iorrana Soares Sousa;SOUSA, I. S.;"";2021-02-09 12:08:55
5058709313898947;Lícia Kércia de Araújo Costa;"COSTA, Lícia Kércia de Araújo;BRITO, Lícia Kércia de Araújo Costa de";"";2021-02-09 13:11:09
9386399124614133;Lucio Lago Lopes;LOPES, L. L.;Centro de Ciências Sociais;2021-02-09 13:23:40
6760553191978988;Lucy Rosana Silva;SILVA, L. R.;Centro de Ciências Sociais;2021-02-09 13:23:53
5183425775828517;Amanda Ferreira Vidal;"VIDAL, A. F.;Ferreira-Vidal, A.;VIDAL, AMANDA;FERREIRA VIDAL, AMANDA;VIDAL, AMANDA F;VIDAL, AMANDA FERREIRA;VIDAL, AMANDA F.";Laboratório de Genética Humana e Médica;
1281555528581499;Iranaldo Santos da Silva;"SILVA, I. S.;Silva, Iranaldo Santos da;DA'SILVA, IRANALDO SANTOS;SANTOS DA SILVA, IRANALDO;DA SILVA, IRANALDO S.;DA SILVA, IRANALDO SANTOS;SILVA, IRANALDO SANTOS";CENTRO DE CIENCIAS EXATAS E TECNOLOGIA;2021-02-09 12:09:17
2313634756775278;Iran de Maria Leitão Nunes;"NUNES, Iran de Maria Leitão;NUNES, IRAN DE MARIA LEITÃO";Centro de Ciências Sociais;2021-02-09 12:09:28
4103483436201595;Pedro Michel da Silva Serejo;SEREJO, P. M. S.;SEREJO ADVOCACIA E CONSULTORIA JURÍDICA;2020-05-18 22:04:40
2234784405131192;Amanda Jordão Silva de Deus;DEUS, A. J. S.;"";2019-03-10 23:10:04
9240410619679358;Laura Rosa Costa Oliveira;"LAURA ROSA COSTA OLIVEIRA;OLIVEIRA, LAURA ROSA COSTA;OLIVEIRA, L.R.C";"";2021-02-09 13:04:15
4463041932789109;Adriana Marques Silva;"SILVA, A. M.;SILVA,Adriana Marques";"";2021-02-09 09:13:38
3837473112893735;Adriano Farias Rios;"RIOS, A. F.;ADRIANO FARIAS RIOS";"";2021-02-09 09:13:56
5424487589164971;Adriano Pereira Coutinho;COUTINHO, A. P.;"";2021-02-09 09:14:04
3274962592469723;Isabela Mendes Costa Campos;CAMPOS, I, M, C.;"";2021-02-09 12:09:49
8215212680474712;Maria Juliana de Souza Alves;ALVES, M. J. S.;"";2018-05-01 13:24:36
3829158068953337;Isabele Batista Mitozo;"MITOZO, I. B.;MITOZO, I.;MITOZO, ISABELE BATISTA;MITOZO, ISABELE B.;MITOZO, ISABELE";Curso de Jornalismo - Campus Imperatriz;2021-02-09 12:10:00
3761504100466582;Camila Maria Santana Costa Buna;BUNA, Camila Maria Santana Costa;"";2019-04-17 17:37:04
1979952517122301;Amanda de Almeida Silva;SILVA, A. A.;"";2018-05-01 11:21:42
861725321644797;Marcelo Derzi Vidal;"VIDAL, M. D.;VIDAL, MARCELO DERZI";Centro Nacional de Pesquisa da Biodiversidade e Povos Tradicionais - CNPT;2021-02-09 13:35:02
3850211425549021;Luana Marques Mesquita;MESQUITA, L. M.;"";2019-12-15 23:21:24
765622564575420;Isabel Ibarra Cabrera;"CABRERA, I. I.;IBARRA,I.";Centro de Ciências Humanas;2021-02-09 12:10:12
2849005041714331;Luana Torres Santos Campelo;SANTOS, L. T. C.;"";2019-12-15 23:21:28
5421990136038081;Leila Maria Chagas Serra;"SERRA, L. M. C.;SERRA, LEILA MARIA CHAGAS";"";2021-02-09 13:04:58
3355731135768067;Letycya Cristina Barbosa Vieira;"VIEIRA, L. C. B.;VIEIRA, Letycya Cristina Barbosa";"";2021-02-09 13:10:26
11106442007433;Silvano Alves Bezerra da Silva;SILVA, S. A. B.;Centro de Ciências Sociais;2021-02-09 15:37:06
7478817693366476;Juliana de Freitas Góes Campos;GÓES, J. F.;"";2021-02-09 12:54:56
7158258338699907;Lucas Henrique Silva Correia;CORREIA, L. H. S.;"";2021-02-09 13:17:29
4709692367337633;Olena Volodymyrivna Kovtun;KOVTUN, O. V.;Centro de Ciências Sociais;2017-11-27 11:51:11
1391985133053726;Humberto Filomeno da Silva Filho;"SILVA FILHO, Humberto Filomeno da;SILVA FILHO, HUMBERTO F.";Centro Tecnológico;2021-02-09 12:05:05
925298269489319;Marcelo Martins dos Santos Brito;BRITO, M. M. S.;Associação de Ensino;2021-02-09 13:36:17
8902868735068017;Marcelo Pagliosa Carvalho;"CARVALHO, Marcelo Pagliosa;CARVALHO, MARCELO PAGLIOSA";"";2021-02-09 13:36:36
1306757566865618;Noé Nicácio Lima;LIMA, N. N.;Centro de Ciências Sociais;2021-02-09 14:33:09
4671446758250074;Priscila de Oliveira Silva;SILVA, P. O.;Centro de Ciências Humanas;2021-02-09 14:49:39
6398242425955297;Luciana Batalha Sena;SENA, L. B.;"";2021-02-09 13:18:34
6459846479649517;Marcio Ferreira da Silva;"SILVA, M. F.;FERREIRA, M.";"";2021-02-09 13:40:47
5633212068086897;Ricardo André Barbosa Carreira;CARREIRA, R.;Coordenação de Curso;2021-02-09 15:03:34
4020691155204294;Aeriberto Carlos Lindoso de Souza;SOUZA, A. C. L.;"";2021-02-09 09:14:41
1796001694787748;Loide Gomes da Silva Ferreira;FERREIRA, L. G. S.;"";2021-02-09 13:16:22
7733059780905524;Lucas Santos Silva;SILVA, L. S.;"";2021-02-09 13:18:13
3670282278628016;Olinto Farias Castelo Branco Júnior;"BRANCO JÚNIOR, O. F. C.;BRANCO JUNIOR, O. F. C.";"";2021-02-09 14:33:37
4331563819888795;Márcia Cristina Costa Pinto;PINTO, M. C. C.;Colégio Universitário - UFMA;2021-02-09 13:37:47
5614190872397840;Poliana Cristina de Almeida Fonseca;"FONSECA, P. C. A.;DE ALMEIDA FONSECA, POLIANA CRISTINA;FONSECA, POLIANA CRISTINA DE ALMEIDA;FONSÊCA, POLIANA CRISTINA DE ALMEIDA;Poliana Cristina de Almeida Fonseca;Poliana Cristina de Ameida Fonseca";"";2019-02-07 18:59:51
3696115712661158;Isaide de Araujo Rodrigues;"RODRIGUES, I. A. e RODRIGUES, I.D;Araujo Rodrigues, Isaide;I.A.Rodrigues;Rodrigues, I.A.;Isaide de A. Rodrigues;Isaide A.Rodrigues;Isaide de Araujo Rodrigues;Rodrigues, ID;ISAIDE DE A RODRIGUES;RODRIGUES, ISAIDE DE A.;I. A. RODRIGUES;RODRIGUES, ISAIDE A.;RODRIGUES, ISAIDE ARAUJO;RODRIGUES, ISAIDE;DE'ARAÚJO'RODRIGUES, ISAÍDE;Rodrigues, Isaide de Araujo";Centro de Ciências Exatas e Tecnologia;2021-02-09 12:10:29
7562103789022950;Victor Turolla Silva Estrela;ESTRELA, V. T. S.;"";2019-03-11 02:23:06
5285825489294917;Sonia Malik;"MALIK, S.;MALIK, SONIA";Centro de Ciências da Saúde;2019-03-08 02:29:18
7441622441541113;Ricardo Luis Beckman Brandão;BRANDÃO, R. L. B.;"";2021-02-09 15:05:09
8809100064538149;Reutmann Ramos dos Santos;SANTOS, Reutmann Ramos dos;Hospital Universitário da Universidade Federal do Maranhão;
4961765012399435;Luciana Bugarin Caracas;"CARACAS, L. B.;CARACAS, LUCIANA BUGARIN";Centro Tecnológico;2018-11-16 12:27:25
8264462953733077;Washington Luís Campos Rio Branco;BRANCO, W. L. C. R.;Centro de Ciências Humanas (CCH);2021-02-09 16:07:46
969381423135680;Diogo Souza Ferreira Rubim de Assis;"ASSIS, D. S. F. R.;Assis, Diogo Souza Ferreira Rubim;de Assis, D.S. Ferreira Rubim;de Assis DS;DE ASSIS, D.S.F.R;DE ASSIS, D.S.F.R.;DE ASSIS, DIOGO SOUZA FERREIRA RUBIM";Centro de Ciências da Saúde;2021-02-09 10:55:31
9447732151434624;Isalena Santos Carvalho;CARVALHO, I. S.;Centro de Ciências Humanas (CCH) / Departamento de Psicologia;2021-02-09 12:10:48
2937261295093927;Roberta Maria Duailibe Ferreira;FERREIRA, R. M. D.;"";2018-05-01 13:54:36
8994540102582050;Isaura Leticia Tavares Palmeira Rolim;"ROLIM, Isaura Leticia Tavares Palmeira;ROLIM, I. L. T. P.;ROLIM, ISAURA LETÍCIA TAVARES PALMEIRA;ISAURA ROLIM;ROLIM, ISAURA;ISAURA LETICIA TAVARES PALMEIRAS ROLIM;ROLIM, I.L.T.P.;Isaura Letícia Tavares Palmeiras Rolim;Palmeiras Rolim, Isaura Letícia Tavares";Departamento de Enfermagem;2021-02-09 12:11:01
6056066450614670;Ismênia Ribeiro de Oliveira;"OLIVEIRA, I. R.;OLIVEIRA, ISMÊNIA R. DE;DE OLIVEIRA, ISMÊNIA RIBEIRO;OLIVEIRA, ISMÊNIA RIBEIRO DE";CENTRO DE CIÊNCIAS AGRÁRIAS E AMBIENTAIS;2021-02-09 12:11:47
3220716493472066;Rafael Mendonça Almeida;"ALMEIDA, Rafael Mendonça;Almeida, Rafael M.;Almeida, R.M.;ALMEIDA, R. M.;ALMEIDA, R M;ALMEIDA, RAFAEL M";"";2021-02-09 14:53:25
6787739620532199;Raimunda de Jesus Araujo Ribeiro;"Raimunda Araujo Ribeiro;Raimunda Ribeiro";Centro de Ciências Sociais;2021-02-09 14:53:37
4763783174889014;Ulisses Denache Vieira Souza;"SOUZA, Ulisses Denache Vieira;Souza, Ulisses Denache Vieira";Colégio de Aplicação da UFMA;2021-02-09 15:53:38
8066309579033344;Ingrid Ribeiro de Sá Vale;VALE, I. R. S.;"";2019-03-11 00:21:16
3122591321814091;Raianna Galdez Lobo;LOBO, R. G.;IFTO-Campus Araguatins;2019-12-16 00:36:22
2891665766732428;Ana Fernanda de Sousa do Espirito Santo;SANTO, A. F. S. E.;"";2021-02-09 09:32:58
3791222560834437;Ilana Barros Moraes da Graça;"MORAES, I. B.;GRAÇA, I. B. M.";"";2021-02-09 12:06:29
4590358575743768;Luiz Marcos de Sousa Sampaio;SAMPAIO, L. M. S.;Campus de São Bernardo;2021-02-09 13:29:47
4848189563701095;Márcia Teixeira Marques;MARQUES, M. T.;Pró-Reitoria de Recursos Humanos;2021-02-09 13:39:49
3921923500456632;Diana Rocha da Silva;"SILVA, D. R.;DA SILVA, DIANA ROCHA;SILVA, DIANA ROCHA DA";"";2021-02-09 10:53:46
9733819682295833;Rozijane Santos Fernandes;"FERNANDES, Rozijane Santos;FERNANDES, ROZIJANE SANTOS;FERNANDES, R.;FERNANDES, R.S.;FERNANDES, ROZIJANE S.;Fernandes, Rozijane S.";Centro de Ciências Agrárias e Ambientais - CCAA;2021-02-09 15:22:57
9097512115715636;Tadeu de Paula Souza;"SOUZA, T. P.;SOUZA, TADEU DE PAULA;Paula, T;TADEU DE PAULA";Centro de Ciências da Saúde;2017-11-27 12:04:02
9431838282439114;Igor Bergamo Anjos Gomes;GOMES, Igor Bergamo Anjos;Pró-Reitoria de Graduação;2021-02-09 12:05:38
8349173244000012;Lucas Arruda Santiago;SANTIAGO, Lucas Arruda;Campus Balsas;2021-02-09 13:16:56
2758276095224568;Pedro Barbosa Soares Junior;SOARES JUNIOR, P. B.;"";2021-02-09 14:46:17
3938675581591626;Iradenia da Silva Sousa;SOUSA, Iradenia da Silva;"";2020-05-18 19:51:37
7844518424301795;Suzanna de Sousa Silva;"SILVA, Suzanna de Sousa;SILVA, SUZANNA DE SOUSA";Coordenação do Curso de Licenciatura em Ciências Naturais - Pinheiro;2021-02-09 15:44:09
4895060623690154;Henrique Dantas Neder;"NEDER, H. D.;NÉDER, H. D.;NEDER, H.D.;NEDER, HENRIQUE DANTAS";Faculdade de Artes, Filosofia e Ciências Sociais;2019-05-03 18:37:52
7887791233427589;Ana Carolina da Cruz Reis;REIS, A. C. C.;Pró-Reitoria de Graduação;2018-05-01 11:22:19
4612474672481875;István van Deursen Varga;"VARGA, István van Deursen;VARGA, IVD;VARGA, I.V.D.";Mestrado Em Saúde e Ambiente;2021-02-09 12:12:00
9764167600174587;Ivaldo Paz Nunes;"NUNES, I.;NUNES, IVALDO";Departamento de Matemática;2021-02-09 12:12:35
5476972076503010;José Carlos Pereira da Silva Júnior;SILVA JUNIOR, J. C. P.;"";2021-02-09 12:39:00
2568153409243271;Laura Antoniêta Araújo Soares Marques;MARQUES, Laura Antoniêta Araújo Soares;Reitoria;2021-02-09 13:04:05
9673352010472883;Samarone Carvalho Marinho;"MARINHO, S. C.;MARINHO, SAMARONE CARVALHO";"";2021-02-09 15:27:15
6375500132304272;Tania Mara Vieira Santos;SANTOS, T. M. V.;"";2021-02-09 15:46:24
7156244951049788;Wllington Jorge dos Santos;SANTOS, W. J.;"";2018-05-01 14:21:31
6429048487893275;Wanderson Gomes Robson;ROBSON, W. G.;"";
3964114535425211;Ulisses Magalhães Nascimento;"NASCIMENTO, Ulisses Magalhães;NASCIMENTO, ULISSES MAGALHÃES;NASCIMENTO, U. M.";Centro Tecnológico;2021-02-09 15:53:51
8690269370445634;Marco Antonio Nogueira Gomes;GOMES, M. A. N.;Centro de Ciencias Exatas e Naturais;2018-11-16 12:37:45
1413455359220789;Leandro Pessoa Carneiro;CARNEIRO, L. P.;HUUFMA;2019-12-15 23:11:13
4405614003048229;Lucele Gonçalves Lima Araújo;ARAÚJO, L. G. L.;Centro de Ciências Biológicas e da Saúde - CCBS;2021-02-09 13:18:13
1364853121392385;Roselane Laíza Lima Martins;MARTINS, R. L. L.;Pró-Reitoria de Graduação;2021-02-09 15:19:46
4647820580023571;Luciana Melo Cordeiro;CORDEIRO, L. M.;Hospital Universitario Materno Infentil;2021-02-09 13:19:17
8991542895559113;Aichely Rodrigues da Silva;"SILVA, A. R. da;Silva, Aichely Rodrigues da;SILVA, Aichely Rodrigues da;SILVA,A.R.;DA SILVA, AICHELY RODRIGUES";"";2021-02-09 09:14:53
9276964152269330;Iasmin Mayara de Lima de Souza;SOUZA, I. M. L.;"";2021-02-09 12:05:36
9210984606441444;Ivanete Coimbra Cavalcante Sousa;SOUSA, I. C. C.;"";2021-02-09 12:12:59
3701824724799551;Joseilma de Azevedo Garrido;GARRIDO, J. A.;"";2021-02-09 12:46:19
9131896969796519;Marcos Abraão Borges Santos;SANTOS, M. A. B.;"";2021-02-09 13:42:54
8263828502425458;Paulo Cesar de Oliveira Queiroz;QUEIROZ, P. C. O.;Centro Tecnológico;2021-02-09 14:42:41
4193294359977923;Wellington Rodrigues Veras;VERAS, W. R.;"";2020-12-02 23:15:28
3401927121372877;Alex Carvalho Andrade;"ANDRADE, A. C.;ANDRADE, ALEX CARVALHO";CAMPUS PROFESSOR ALEXANDRE ALVES DE OLIVEIRA;2018-05-01 11:19:08
9565642520965718;Nayolly Amorim Martins Bezerra;BEZERRA, N. A. M.;Hospital Universitário da Universidade Federal do Maranhão;2019-03-11 01:36:02
480132987629522;Ana Carolina Alves Malheiros Araújo;ARAÚJO, A. C. A. M.;"";2018-05-01 11:22:17
3359554102559453;Ana Gardenia Lima Martins Mendes;"MENDES, A. G. L. M.;MARTINS, A. G. L";"";
4359744599227882;Alberto Jorge Oliveira Lopes;"LOPES, A. J. O.;LOPES, AJO;LOPES, ALBERTO J. O.;LOPES, ALBERTO JORGE O.;LOPES, ALBERTO JORGE OLIVEIRA;LOPES";"";2021-02-09 09:16:03
5402757022004132;Ilana Drumond Poloniato;POLONIATO, I. D.;"";2021-02-09 12:06:29
2308374458899411;Ilainny Silva Santos;SANTOS, I. S.;"";2019-12-15 22:25:33
9729658903719164;Ivetilde Nascimento Delgado Mota;MOTA, I. N. D.;Centro de Ciências Sociais, Saúde e Tecnologia (CCSST) - Imperatriz;2021-02-09 12:13:06
8704661941460893;Raimundo Benicio Sousa Junior;SOUSA JUNIOR, R. B.;Superintendencia Regional-MA;2021-02-09 14:56:15
4349177951585888;Alda Dantas do Rêgo;DANTAS, A.R.;Centro de Ciencias Sociais, Saúde e Teconologia;2021-02-09 09:16:36
3488859631012266;Aldely Elene Pereira de Pinho;PINHO, A. E. P.;Clínica Cirúrgica/HUPD;2021-02-09 09:17:49
3147110356268274;Luis Douglas Miranda Silva;"SILVA, L. D. M.;SILVA, LUIS DOUGLAS MIRANDA";"";
4129294255209246;Diniz Batista de Vasconcelos;VASCONCELOS, D. B.;"";2019-12-15 21:25:43
9943494523424464;Ivo Alexandre Leme da Cunha;"CUNHA, I. A. L.;CUNHA, I. A. L. da;Cunha, I. A. L.;Cunha, Ivo Alexandre Leme da;da Cunha, Ivo Alexandre Leme;CUNHA, IVO ALEXANDRE L DA;LEME DA CUNHA, IVO ALEXANDRE;CUNHA, IVO";Centro de Ciências Agrárias e Ambientais;2021-02-09 12:13:08
9599905005153701;Ivone Garros Rosa;"GARROS-ROSA, I.;ROSA, IVONE GARROS;ROSA, IVONE G";Centro de Ciências da Saúde;2021-02-09 12:13:39
9666603291700197;Eline Pedrosa Almeida Polizelli;POLIZELLI, E. P. A.;"";2018-11-16 11:28:48
4908743570747531;Julianna Santos Farias;"FARIAS, J. S.;FARIAS, JULIANNA SANTOS";"";2019-05-03 19:05:09
1252449346220785;Izabelle Smith Frazão Ramos;"RAMOS, I. S. F.;RAMOS, IZABELLE SMITH FRAZÃO";"";2021-02-09 12:14:44
4530277978378286;Bruno Leonardo Pereira da Silva;SILVA, B. L. P.;"";2018-01-16 15:52:14
7000824780344739;Raimundo Luna Neres;"NERES, R. L.;NERES, RAIMUNDO LUNA;https://orcid.org/0000-0001-9082-7885";Pró Reitoria de Pós-Graduação, Pesquisa e Extensão;2020-05-18 22:12:31
8981790396061410;Marcos Antonio Pereira dos Santos;"SANTOS, Marcos Antonio Pereira dos;PEREIRA DOS SANTOS, MARCOS ANTONIO;SANTOS, MARCOS ANTÔNIO PEREIRA DOS;PEREIRA DOS SANTOS, MARCOS ANTÔNIO;SANTOS, MARCOS A.P;SANTOS, MARCOS A.P.;Dos Santos MAP;Santos MA;Dos Santos MA;DOS SANTOS, MARCOS ANTONIO PEREIRA";"";2020-12-02 20:43:41
7002164478576119;Beatriz de Oliveira Pereira;PEREIRA, B. O.;"";2018-05-01 11:39:08
1438152709911272;Ana Adélia Jansen Cutrim Avelar;AVELAR, A. A. J. C.;"";2021-02-09 09:29:42
3782678653437368;André Luís Bezerra Ferreira;FERREIRA, André Luís Bezerra;Instituto de Filosofia e Ciências Humanas - PPHIST;2018-05-01 11:28:34
1033417364789024;Charlyan de Sousa Lima;"LIMA, C. S.;Lima, Charlyan de Souza";"";2018-05-01 11:46:26
6643079642437254;Yuri Lopes Nassar;NASSAR, Y. L.;"";2019-12-16 01:38:19
7950642644511983;Guillaume Xavier Rousseau;"ROUSSEAU, G. X., ROUSSEAU, G.;Rousseau, Guillaume Xavier;ROUSSEAU, G;Rousseau, G.X.;Rousseau, Guillaume X.;Terra Preta de Indio Network";Programa de Pós-graduação em Agroecologia;2019-12-15 22:19:11
3749023674323858;Hamilton Nogueira Makosky;"MAKOSKY, Hamilton Nogueira;MAKOSKY, HAMILTON NOGUEIRA";Centro de Ciências Sociais;2021-02-09 11:59:30
9119302868727496;Ivone Lopes Lima;LIMA, I. L.;Centro de Ciências Exatas e Tecnologia;2021-02-09 12:14:43
5984899472616752;Leonardo Gonçalves de Lima;"LIMA, L. G.;GONÇALVES DE LIMA, LEONARDO;Lima, Leonardo Gonçalves de;LIMA, L.G.";Centro de Ciências da Saúde;2021-02-09 13:07:33
7820773795322903;Leonardo Hunaldo dos Santos;"SANTOS, L. H.;SANTOS, LEONARDO HUNALDO DOS;HUNALDO DOS SANTOS, LEONARDO;DOS SANTOS, LEONARDO HUNALDO;Santos, Leonardo Hunaldo;Leonardo Hunaldo dos Santos;Santos, Hunaldo dos Santos;SANTOS, HUNALDO DOS SANTOS;SANTOS, HUNADO DOS SANTOS;SANTOS, LEONARDO HUNADO DOS";Centro de Ciências Agrárias;2021-02-09 13:07:51
7621234293958489;Edhyelem Almeida Santos;SANTOS, E. A.;Comando de Segurança Comunitária - PROERD;2020-12-02 17:44:59
3916373301527075;José Augusto Borges Vaz;VAZ, J. Augusto B.;Pró-reitoria de Recursos Humanos;2021-02-09 12:37:55
5699049219268606;Leonardo Leocádio Coelho de Souza;SOUZA, L. L. C;Centro de Ciências Sociais, Saúde e Tecnologia (CCSST);2021-02-09 13:08:15
5691347913155955;Maria Jozelia Diniz Moraes;MORAES, M. J. D.;Hospital Universitário da Universidade Federal do Maranhão;2021-02-09 14:00:44
6044525155981265;Itala Barros;BARROS, I.;"";2021-02-09 12:12:18
